sr_id,sr_doi,refnum,year,doi,url,raw,bib_key
Shool2025,10.1186/s12911-025-02954-4,563,2025,,,"Wawrzuta DN, A.; Ludwikowska, K.; Jaruševičius, L.; Trofimoviča-Krasnorucka, A.; Rausis, G.; Szulc, A.; Pędziwiatr, K.; Poláchová, K.; Klejdysz, J.; Chojnacka, M. Large language models for pretreatment education in pediatric radiation oncology: A comparative evaluation study. Clin Transl Radiat Oncol. 2025;51.",Shool2025_supp_ref0563
Shool2025,10.1186/s12911-025-02954-4,564,2024,,,"Yang FY, D.; Wang, Z. Large-Scale assessment of ChatGPT's performance in benign and malignant bone tumors imaging report diagnosis and its potential for clinical applications. Journal of bone oncology. 2024;44.",Shool2025_supp_ref0564
Shool2025,10.1186/s12911-025-02954-4,565,2024,,,"Bannett YG, F.; Pillai, M.; Herrmann, J. E.; Luo, I.; Huffman, L. C.; Feldman, H. M. Leveraging a Large Language Model to Assess Quality-of-Care: Monitoring ADHD Medication Side Effects. medRxiv. 2024.",Shool2025_supp_ref0565
Shool2025,10.1186/s12911-025-02954-4,566,2024,,,"Ali RC, H. Leveraging ChatGPT for Enhanced Aesthetic Evaluations in Minimally Invasive Facial Procedures. Aesthetic plastic surgery. 2024.",Shool2025_supp_ref0566
Shool2025,10.1186/s12911-025-02954-4,567,2024,,,"Zhu QQC, X. Y.; Jin, Q.; Hou, B.; Mathai, T. S.; Mukherjee, P.; Gao, X.; Summers, R. M.; Lu, Z. Y.; Ieee Computer, S. O. C., editor Leveraging Professional Radiologists' Expertise to Enhance LLMs' Evaluation for AI-generated Radiology Reports. 12th IEEE International Conference on Healthcare Informatics (IEEE-ICHI); 2024 Jun 03-06; Orlando, FL. LOS ALAMITOS: Ieee Computer Soc; 2024.",Shool2025_supp_ref0567
Shool2025,10.1186/s12911-025-02954-4,568,2024,,,"Raganato AB, F.; Crocamo, C.; Cavaleri, D.; Carrà, G.; Pasi, G.; Viviani, M., editor Leveraging Prompt Engineering and Large Language Models for Automating MADRS Score Computation for Depression Severity Assessment. CEUR Workshop Proceedings; 2024: CEUR-WS.",Shool2025_supp_ref0568
Shool2025,10.1186/s12911-025-02954-4,569,2025,,,"Kebe GY, Girard JM, Liebenthal E, Baker J, De la Torre F, Morency L-P. LlaMADRS: Prompting Large Language Models for Interview-Based Depression Assessment. arXiv preprint arXiv:250103624. 2025.",Shool2025_supp_ref0569
Shool2025,10.1186/s12911-025-02954-4,570,2025,,,"Healey EK, I. LLM-CGM: A Benchmark for Large Language Model-Enabled Querying of Continuous Glucose Monitoring Data for Conversational Diabetes Management. Pacific Symposium on Biocomputing Pacific Symposium on Biocomputing. 2025;30:82-93.",Shool2025_supp_ref0570
Shool2025,10.1186/s12911-025-02954-4,571,2024,,,"Hou R, Chen S, Fan Y, Zhu L, Sun J, Liu J, et al. MSDiagnosis: An EMR-based Dataset for Clinical Multi-Step Diagnosis. arXiv preprint arXiv:240810039. 2024.",Shool2025_supp_ref0571
Shool2025,10.1186/s12911-025-02954-4,572,2024,,,"King RCS, J. S.; Yeo, Y. H.; Peng, Y.; Kunkel, D. C.; Habib, A. A.; Ghashghaei, R. A Multidisciplinary Assessment of ChatGPT's Knowledge of Amyloidosis: Observational Study. JMIR cardio. 2024;8:e53421.",Shool2025_supp_ref0572
Shool2025,10.1186/s12911-025-02954-4,573,2024,,,"Fernández Cabrera AGdS, J.; Santamaría Montero, P.; Chinea García, H.; Pego Reigosa, R. NeuroGPT, evaluating chatGPT: diagnosis and treatment of 72 patients. Neurol Argent. 2024;16(3):136-41.",Shool2025_supp_ref0573
Shool2025,10.1186/s12911-025-02954-4,574,2024,,,"Long CL, K.; Zhang, J.; dos Santos, A.; Alanazi, A.; O'Brien, D.; Wright, E. D.; Cote, D. A Novel Evaluation Model for Assessing ChatGPT on Otolaryngology-Head and Neck Surgery Certification Examinations: Performance Study. JMIR medical education. 2024;10(1).",Shool2025_supp_ref0574
Shool2025,10.1186/s12911-025-02954-4,575,2024,,,"Choi YKL, S. Y.; Fick, D. M.; Shulman, R. W.; Lee, S.; Shrestha, P.; Santoso, K. Optimizing ChatGPT's Interpretation and Reporting of Delirium Assessment Outcomes: Exploratory Study. JMIR formative research. 2024;8:e51383.",Shool2025_supp_ref0575
Shool2025,10.1186/s12911-025-02954-4,576,2025,,,"Trapp CS-H, N.; Keilholz, M.; Brose, S. F.; Marschner, S. N.; Schönecker, S.; Maier, S. H.; Dehelean, D. C.; Rottler, M.; Konnerth, D.; Belka, C.; Corradini, S.; Rogowski, P. Patient- and clinician-based evaluation of large language models for patient education in prostate cancer radiotherapy. Strahlentherapie und Onkologie : Organ der Deutschen Rontgengesellschaft  [et al]. 2025.",Shool2025_supp_ref0576
Shool2025,10.1186/s12911-025-02954-4,577,2024,,,"Huang TS, C.; Socrates, V.; Chartash, D.; Wright, D.; Dilip, M.; Sangal, R. B.; Taylor, R. A. Patient-Representing Population's Perceptions of GPT-Generated Versus Standard Emergency Department Discharge Instructions: Randomized Blind Survey Assessment. Journal of medical Internet research. 2024;26:e60336.",Shool2025_supp_ref0577
Shool2025,10.1186/s12911-025-02954-4,578,2024,,,"Zhang Q, Chen P, Li J, Feng L, Liu S, Chen M, et al. PediaBench: A Comprehensive Chinese Pediatric Dataset for Benchmarking Large Language Models. arXiv preprint arXiv:241206287. 2024.",Shool2025_supp_ref0578
Shool2025,10.1186/s12911-025-02954-4,579,2024,,,"Huang CYZ, E.; Caussade, M. C.; Brown, T.; Stockton Hogrogian, G.; Yan, A. C. Pediatric dermatologists versus AI bots: Evaluating the medical knowledge and diagnostic capabilities of ChatGPT. Pediatric dermatology. 2024;41(5):831-4.",Shool2025_supp_ref0579
Shool2025,10.1186/s12911-025-02954-4,580,2024,,,"Balamurali BTC, J. M. Performance Assessment of ChatGPT versus Bard in Detecting Alzheimer's Dementia. Diagnostics. 2024;14(8):13.",Shool2025_supp_ref0580
Shool2025,10.1186/s12911-025-02954-4,581,2025,,,"Seo SK, K.; Yang, H. Performance Assessment of Large Language Models in Medical Consultation: A Comparative Study. JMIR medical informatics. 2025.",Shool2025_supp_ref0581
Shool2025,10.1186/s12911-025-02954-4,582,2024,,,"Harada YS, T.; Harada, T.; Sakamoto, T.; Ishizuka, K.; Miyagami, T.; Kawamura, R.; Kunitomo, K.; Nagano, H.; Shimizu, T.; Watari, T. Performance evaluation of ChatGPT in detecting diagnostic errors and their contributing factors: an analysis of 545 case reports of diagnostic errors. BMJ open quality. 2024;13(2).",Shool2025_supp_ref0582
Shool2025,10.1186/s12911-025-02954-4,583,2024,,,"Toyama YH, A.; Abe, M.; Nagano, M.; Kawabata, M.; Seki, Y.; Takase, K. Performance evaluation of ChatGPT, GPT-4, and Bard on the official board examination of the Japan Radiology Society. Jpn J Rad. 2024;42(2):201-7.",Shool2025_supp_ref0583
Shool2025,10.1186/s12911-025-02954-4,584,2024,,,"Goto HS, Y.; Okada, S. Performance Evaluation of GPT-4o and o1-Preview Using the Certification Examination for the Japanese 'Operations Chief of Radiography With X-rays'. Cureus. 2024;16(11):e74262.",Shool2025_supp_ref0584
Shool2025,10.1186/s12911-025-02954-4,585,2024,,,"Reyhan AHM, Ç; Uzun, I.; Yüksekyayla, F. A Performance Evaluation of Large Language Models in Keratoconus: A Comparative Study of ChatGPT-3.5, ChatGPT-4.0, Gemini, Copilot, Chatsonic, and Perplexity. Journal of Clinical Medicine. 2024;13(21):14.",Shool2025_supp_ref0585
Shool2025,10.1186/s12911-025-02954-4,586,2024,,,"Wei Q, Cui Y, Ding M, Wang Y, Xiang L, Yao Z, et al. Performance Evaluation of Lightweight Open-source Large Language Models in Pediatric Consultations: A Comparative Analysis. arXiv preprint arXiv:240715862. 2024.",Shool2025_supp_ref0586
Shool2025,10.1186/s12911-025-02954-4,587,2024,,,"Wang TM, A. G.; Stelter, K.; O’Neill, T. R.; Newton, W. P. Performance Evaluation of the Generative Pre-trained Transformer (GPT-4) on the Family Medicine In-Training Examination. J Am Board Fam Med. 2024;37(4):528-82.",Shool2025_supp_ref0587
Shool2025,10.1186/s12911-025-02954-4,588,2024,,,"Flynn JCZ, J.; Arango, S. D.; Pineda, N.; Miller, A. J.; Weir, T. B. The Performance of a Customized Generative Pre-trained Transformer on the American Society for Surgery of the Hand Self-Assessment Examination. Cureus. 2024;16(9):e70205.",Shool2025_supp_ref0588
Shool2025,10.1186/s12911-025-02954-4,589,2024,,,"Arruzza ESE, C. M.; Chau, M. The performance of ChatGPT-4.0o in medical imaging evaluation: a cross-sectional study. J Edu Eval Health Prof. 2024;21.",Shool2025_supp_ref0589
Shool2025,10.1186/s12911-025-02954-4,590,2024,,,"Noda RI, Y.; Kitano, F.; Komatsu, J.; Ichikawa, D.; Shibagaki, Y. Performance of ChatGPT and Bard in self-assessment questions for nephrology board renewal. Clinical and experimental nephrology. 2024;28(5):465-9.",Shool2025_supp_ref0590
Shool2025,10.1186/s12911-025-02954-4,591,2024,,,"Cheng TTL, Y.; Gu, J. Q.; He, Y. B.; He, G. B.; Zhou, P. P.; Li, S. Y.; Xu, H.; Bao, Y.; Wang, X. J. The performance of ChatGPT in day surgery and pre-anesthesia risk assessment: a case-control study of 150 simulated patient presentations. Perioperative Med. 2024;13(1):9.",Shool2025_supp_ref0591
Shool2025,10.1186/s12911-025-02954-4,592,2024,,,"Zong HL, J. K.; Wu, E. R.; Wu, R. R.; Lu, J. Y.; Shen, B. R. Performance of ChatGPT on Chinese national medical licensing examinations: a five-year examination evaluation study for physicians, pharmacists and nurses. BMC Med Educ. 2024;24(1):9.",Shool2025_supp_ref0592
Shool2025,10.1186/s12911-025-02954-4,593,2024,,,"Leitão CAS, G. L. O.; Rabelo, L. M.; Escuissato, D. L. Performance of ChatGPT on questions from the Brazilian College of Radiology annual resident evaluation test. Radiologia brasileira. 2024;57:e20230083.",Shool2025_supp_ref0593
Shool2025,10.1186/s12911-025-02954-4,594,2024,,,"Arango SDF, J. C.; Zeitlin, J.; Lorenzana, D. J.; Miller, A. J.; Wilson, M. S.; Strohl, A. B.; Weiss, L. E.; Weir, T. B. The Performance of ChatGPT on the American Society for Surgery of the Hand Self-Assessment Examination. Cureus. 2024;16(4):e58950.",Shool2025_supp_ref0594
Shool2025,10.1186/s12911-025-02954-4,595,2024,,,"Yudovich MSM, E.; Hague, C. M.; Raman, J. D. Performance of GPT-3.5 and GPT-4 on standardized urology knowledge assessment items in the United States: a descriptive study. J Edu Eval Health Prof. 2024;21.",Shool2025_supp_ref0595
Shool2025,10.1186/s12911-025-02954-4,596,2024,,,"Payne DLP, K.; Borrero, W. M.; Chung, K.; Hao, M.; Mpoy, M.; Jin, M.; Prasanna, P.; Hill, V. Performance of GPT-4 on the American College of Radiology In-training Examination: Evaluating Accuracy, Model Drift, and Fine-tuning. Academic radiology. 2024;31(7):3046-54.",Shool2025_supp_ref0596
Shool2025,10.1186/s12911-025-02954-4,597,2024,,,"Revercomb LP, A. M.; Fu, D.; Filimonov, A. Performance of Novel GPT-4 in Otolaryngology Knowledge Assessment. Indian journal of otolaryngology and head and neck surgery : official publication of the Association of Otolaryngologists of India. 2024;76(6):6112-4.",Shool2025_supp_ref0597
Shool2025,10.1186/s12911-025-02954-4,598,2024,,,"Mahajan AT, A.; Tseng, E. S.; Como, J. J.; El-Hayek, K. M.; Ladha, P.; Ho, V. P. Performance of trauma-trained large language models on surgical assessment questions: A new approach in resource identification. Surgery. 2024.",Shool2025_supp_ref0598
Shool2025,10.1186/s12911-025-02954-4,599,2024,,,"Janopaul-Naylor JRK, A.; Qian, D. C.; McCall, N. S.; Liu, Y.; Patel, S. A. Physician Assessment of ChatGPT and Bing Answers to American Cancer Society's Questions to Ask About Your Cancer. Am J Clin Oncol-Cancer Clin Trials. 2024;47(1):17-21.",Shool2025_supp_ref0599
Shool2025,10.1186/s12911-025-02954-4,600,2024,,,"Joseph AJ, K.; Joseph, A. A pilot evaluation of the diagnostic accuracy of ChatGPT-3.5 for multiple sclerosis from case reports. Translational neuroscience. 2024;15(1):20220361.",Shool2025_supp_ref0600
Shool2025,10.1186/s12911-025-02954-4,601,2024,,,"Saba LC, R.; Khouri, J.; Anwer, F.; Landau, H.; Chaulagain, C. A Pilot Study Assessing the Accuracy of AI ChatGPT Responses for AL Amyloidosis. Eur J Haematol. 2024:5.",Shool2025_supp_ref0601
Shool2025,10.1186/s12911-025-02954-4,602,2024,,,"Soleimani MS, N.; Ayyoubzadeh, S. M.; Kalhori, S. R. N.; Keshavarz, H. Practical Evaluation of ChatGPT Performance for Radiology Report Generation. Academic radiology. 2024;31(12):4823-32.",Shool2025_supp_ref0602
Shool2025,10.1186/s12911-025-02954-4,603,2024,,,"Wang MW, J.; Zeng, Y.; Dai, L.; Yan, B.; Zhu, Y.; Wei, X.; Jin, Y.; Li, Y. Precision Structuring of Free-Text Surgical Record for Enhanced Stroke Management: A Comparative Evaluation of Large Language Models. Journal of multidisciplinary healthcare. 2024;17:5163-75.",Shool2025_supp_ref0603
Shool2025,10.1186/s12911-025-02954-4,604,2024,,,"Suzuki KY, H.; Yamazaki, H.; Honda, G.; Sakai, S. Preliminary assessment of TNM classification performance for pancreatic cancer in Japanese radiology reports using GPT-4. Jpn J Rad. 2024.",Shool2025_supp_ref0604
Shool2025,10.1186/s12911-025-02954-4,605,2024,,,"Warren CJE, V. S.; Payne, N. G.; Voletti, S.; Wu, S. Y.; Colquitt, J.; Sadeghi-Nejad, H.; Punjani, N. Prompt matters: evaluation of large language model chatbot responses related to Peyronie's disease. Sex Med. 2024;12(4):qfae055.",Shool2025_supp_ref0605
Shool2025,10.1186/s12911-025-02954-4,606,2024,,,"Ward MU, P.; Toscano, D.; Kashanian, A.; Lynch, D. G.; Horn, A. C.; D’Amico, R. S.; Mittler, M.; Baum, G. R. A Quantitative Assessment of ChatGPT as a Neurosurgical Triaging Tool. Neurosurgery. 2024;95(2):487-95.",Shool2025_supp_ref0606
Shool2025,10.1186/s12911-025-02954-4,607,2024,,,"Li JTG, X.; Dou, T. X.; Gao, Y. Y.; Li, X.; Zhu, W. N. Quantitative evaluation of GPT-4's performance on US and Chinese osteoarthritis treatment guideline interpretation and orthopaedic case consultation. BMJ Open. 2024;14(12):8.",Shool2025_supp_ref0607
Shool2025,10.1186/s12911-025-02954-4,608,2024,,,"Doshi RA, K. S.; Khosla, P.; Bajaj, S.; Chheang, S.; Forman, H. P. Quantitative Evaluation of Large Language Models to Streamline Radiology Report Impressions: A Multimodal Retrospective Analysis. Radiology. 2024;310(3).",Shool2025_supp_ref0608
Shool2025,10.1186/s12911-025-02954-4,609,2024,,,"Matalon JS, A.; Ahsan, S.; White, E.; Kothari, R.; Varma, M. Reader's digest version of scientific writing: comparative evaluation of summarization capacity between large language models and medical students in analyzing scientific writing in sleep medicine. Frontiers in artificial intelligence. 2024;7:1477535.",Shool2025_supp_ref0609
Shool2025,10.1186/s12911-025-02954-4,610,2025,,,"Wang PH, J.; Liu, Z.; Chen, D.; Liu, T.; Shen, J.; Liu, W. A recent evaluation on the performance of LLMs on radiation oncology physics using questions of randomly shuffled options. ArXiv. 2025.",Shool2025_supp_ref0610
Shool2025,10.1186/s12911-025-02954-4,611,2024,,,"Saibene AMA, F.; Calvo-Henriquez, C.; Maniaci, A.; Mayo-Yáñez, M.; Paderno, A.; Vaira, L. A.; Felisati, G.; Craig, J. R. Reliability of large language models in managing odontogenic sinusitis clinical scenarios: a preliminary multidisciplinary evaluation. European archives of oto-rhino-laryngology : official journal of the European Federation of Oto-Rhino-Laryngological Societies (EUFOS) : affiliated with the German Society for Oto-Rhino-Laryngology - Head and Neck Surgery. 2024;281(4):1835-41.",Shool2025_supp_ref0611
Shool2025,10.1186/s12911-025-02954-4,612,2024,,,"Seth IL, B.; Rozen, W. M. Response to ""Letter to the Editor-Exploring the Unknown: Evaluating ChatGPT's Performance in Uncovering Novel Aspects of Plastic Surgery and Identifying Areas for Future Innovation"". Aesthetic plastic surgery. 2024.",Shool2025_supp_ref0612
Shool2025,10.1186/s12911-025-02954-4,613,2024,,,"Sievert MC, O.; Mueller, S. K.; Rupp, R.; Balk, M.; Richter, D.; Mantsopoulos, K.; Iro, H.; Koch, M. Risk stratification of thyroid nodules: Assessing the suitability of ChatGPT for text-based analysis. American journal of otolaryngology. 2024;45(2):104144.",Shool2025_supp_ref0613
Shool2025,10.1186/s12911-025-02954-4,614,2024,,,"Senoymak MCE, N. H.; Senoymak, I.; Firat, S. N. The Role of Artificial Intelligence in Endocrine Management: Assessing ChatGPT's Responses to Prolactinoma Queries. Journal of personalized medicine. 2024;14(4):13.",Shool2025_supp_ref0614
Shool2025,10.1186/s12911-025-02954-4,615,2024,,,"Abdel-Rehim A, Zenil H, Orhobor O, Fisher M, Collins RJ, Bourne E, et al. Scientific Hypothesis Generation by a Large Language Model: Laboratory Validation in Breast Cancer Treatment. arXiv preprint arXiv:240512258. 2024.",Shool2025_supp_ref0615
Shool2025,10.1186/s12911-025-02954-4,616,2024,,,"Restrepo DN, L. F.; Dychiao, R. G.; Wu, C.; McCoy, L. G.; Artiaga, J. C.; Cobanaj, M.; Matos, J.; Gallifant, J.; Bitterman, D. S.; Ferrer, V.; Aphinyanaphongs, Y.; Anthony Celi, L., editor Seeing Beyond Borders: Evaluating LLMs in Multilingual Ophthalmological Question Answering. Proceedings - 2024 IEEE 12th International Conference on Healthcare Informatics, ICHI 2024; 2024: Institute of Electrical and Electronics Engineers Inc.",Shool2025_supp_ref0616
Shool2025,10.1186/s12911-025-02954-4,617,2024,,,"Dani M, Prakash MJ, Akata Z, Liebe S. SemioLLM: Assessing Large Language Models for Semiological Analysis in Epilepsy Research. arXiv preprint arXiv:240703004. 2024.",Shool2025_supp_ref0617
Shool2025,10.1186/s12911-025-02954-4,618,2024,,,"Zhao ZZ, W.; Chen, X.; Song, F.; Gunasegaram, J.; Huang, W.; Shi, D.; He, M.; Liu, N. Slit Lamp Report Generation and Question Answering: Development and Validation of a Multimodal Transformer Model with Large Language Model Integration. Journal of medical Internet research. 2024;26:e54047.",Shool2025_supp_ref0618
Shool2025,10.1186/s12911-025-02954-4,619,2024,,,"Reese JTC, L.; Bridges, Y.; Danis, D.; Caufield, J. H.; Wissink, K.; McMurry, J. A.; Graefe, A. S.; Casiraghi, E.; Valentini, G.; Jacobsen, J. O.; Haendel, M.; Smedley, D.; Mungall, C. J.; Robinson, P. N. Systematic benchmarking demonstrates large language models have not reached the diagnostic accuracy of traditional rare-disease decision support tools. medRxiv. 2024.",Shool2025_supp_ref0619
Shool2025,10.1186/s12911-025-02954-4,620,2024,,,"Sarvari PA-f, Z.; Ghuwel, A.; Al-fagih, O. A systematic evaluation of the performance of GPT-4 and PaLM2 to diagnose comorbidities in MIMIC-IV patients. Health Care Sci. 2024;3(1):3-18.",Shool2025_supp_ref0620
Shool2025,10.1186/s12911-025-02954-4,621,2024,,,"Hussain SN, U.; Ali, M.; Avalos, D. B. A.; Cardona-Huerta, S.; Palomo, B. A. B.; Tamez-Peña, J. G. TECRR: a benchmark dataset of radiological reports for BI-RADS classification with machine learning, deep learning, and large language model baselines. Bmc Medical Informatics and Decision Making. 2024;24(1):10.",Shool2025_supp_ref0621
Shool2025,10.1186/s12911-025-02954-4,622,2024,,,"Zhu LR, Y.; McGee, L. A.; Rwigema, J. C. M.; Patel, S. H. Testing and Validation of a Custom Retrained Large Language Model for the Supportive Care of HN Patients with External Knowledge Base. Cancers. 2024;16(13).",Shool2025_supp_ref0622
Shool2025,10.1186/s12911-025-02954-4,623,2024,,,"Yim WWF, Y.; Abacha, A. B.; Yetisgen, M., editor To Err is Human, How About Medical Large Language Models? Comparing Pre-trained Language Models for Medical Assessment Errors and Reliability. 2024 Joint International Conference on Computational Linguistics, Language Resources and Evaluation, LREC-COLING 2024 - Main Conference Proceedings; 2024: European Language Resources Association (ELRA).",Shool2025_supp_ref0623
Shool2025,10.1186/s12911-025-02954-4,624,2024,,,"Tayebi Arasteh SS, R.; Huppertz, M.; Lotfinia, M.; Puladi, B.; Kuhl, C.; Truhn, D.; Nebelung, S. The Treasure Trove Hidden in Plain Sight: The Utility of GPT-4 in Chest Radiograph Evaluation. Radiology. 2024;313(2):e233441.",Shool2025_supp_ref0624
Shool2025,10.1186/s12911-025-02954-4,625,2024,,,"Yang ZC, S.; Vucetic, S., editor Two-Pronged Human Evaluation of ChatGPT Self-Correction in Radiology Report Simplification. Proceedings of the Annual Meeting of the Association for Computational Linguistics; 2024: Association for Computational Linguistics (ACL).",Shool2025_supp_ref0625
Shool2025,10.1186/s12911-025-02954-4,626,2024,,,Mheidly N. Unleashing the power of AI: Assessing the reliability of ChatGPT in disseminating breast cancer awareness. Journal of education and health promotion. 2024;13:172.,Shool2025_supp_ref0626
Shool2025,10.1186/s12911-025-02954-4,627,2023,,,"Hussain HETKSABMKWKEADA-JA, editor Unveiling the Reliability of ChatGPT Answers in the Biomedical Realm: An Assessment in the. 2023 16th International Conference on Developments in eSystems Engineering (DeSE); 2023 18-20 Dec. 2023.",Shool2025_supp_ref0627
Shool2025,10.1186/s12911-025-02954-4,628,2024,,,"Ozgor FC, U.; Halis, A.; Cakir, H.; Aksu, U. C.; Ayranci, A.; Sarilar, O. Urological Cancers and ChatGPT: Assessing the Quality of Information and Possible Risks for Patients. Clinical genitourinary cancer. 2024;22(2):454-7.e4.",Shool2025_supp_ref0628
Shool2025,10.1186/s12911-025-02954-4,629,2024,,,"Williams CYKZ, T.; Miao, B. Y.; Sushil, M.; Wang, M.; Kornblith, A. E.; Butte, A. J. Use of a Large Language Model to Assess Clinical Acuity of Adults in the Emergency Department. JAMA network open. 2024;7(5):e248895.",Shool2025_supp_ref0629
Shool2025,10.1186/s12911-025-02954-4,630,2024,,,"Haver HLY, P. H.; Jeudy, J.; Bahl, M. Use of ChatGPT to Assign BI-RADS Assessment Categories to Breast Imaging Reports. AJR American journal of roentgenology. 2024;223(3):e2431093.",Shool2025_supp_ref0630
Shool2025,10.1186/s12911-025-02954-4,631,2024,,,"Chen YFZ, S. Q.; Tang, N.; George, D. M.; Huang, T. L.; Tang, J. P. Using Google web search to analyze and evaluate the application of ChatGPT in femoroacetabular impingement syndrome. Front Public Health. 2024;12:10.",Shool2025_supp_ref0631
Shool2025,10.1186/s12911-025-02954-4,632,2024,,,"Chang JL, K. J.; Wang, T. H.; Chen, C. M. Utilizing ChatGPT for Curriculum Learning in Developing a Clinical Grade Pneumothorax Detection Model: A Multisite Validation Study. Journal of clinical medicine. 2024;13(14).",Shool2025_supp_ref0632
Shool2025,10.1186/s12911-025-02954-4,633,2024,,,"Lee KHL, R. W.; Kwon, Y. E. Validation of a Deep Learning Chest X-ray Interpretation Model: Integrating Large-Scale AI and Large Language Models for Comparative Analysis with ChatGPT. Diagnostics. 2024;14(1):13.",Shool2025_supp_ref0633
Shool2025,10.1186/s12911-025-02954-4,634,2024,,,"Vallurupalli MS, N. D.; Vyas, R. M. Validation of ChatGPT 3.5 as a Tool to Optimize Readability of Patient-facing Craniofacial Education Materials. Plast Reconstr Surg, Glob Open. 2024;12(2):E5575.",Shool2025_supp_ref0634
Shool2025,10.1186/s12911-025-02954-4,635,2024,,,"Wang YCH, Y. T.; Nimma, I. R.; Pang, S. H.; Pang, M. Y.; Cui, T.; Kumbhari, V. Validation of GPT-4 for clinical event classification: A comparative analysis with ICD codes and human reviewers. J Gastroenterol Hepatol. 2024;39(8):1535-43.",Shool2025_supp_ref0635
Shool2025,10.1186/s12911-025-02954-4,636,2024,,,"Cheligeer KW, G.; Laws, A.; Quan, M. L.; Li, A.; Brisson, A. M.; Xie, J.; Xu, Y. Validation of large language models for detecting pathologic complete response in breast cancer using population-based pathology reports. BMC Med Inform Decis Mak. 2024;24(1):283.",Shool2025_supp_ref0636
Shool2025,10.1186/s12911-025-02954-4,637,2024,,,"Paiola PH, Garcia GL, Manesco JRR, Roder M, Rodrigues D, Papa JP. Adapting LLMs for the Medical Domain in Portuguese: A Study on Fine-Tuning and Model Evaluation. arXiv preprint arXiv:241000163. 2024.",Shool2025_supp_ref0637
Shool2025,10.1186/s12911-025-02954-4,638,2025,,,"Wang CL, S.; Lin, N.; Zhang, X.; Han, Y.; Wang, X.; Liu, D.; Tan, X.; Pu, D.; Li, K.; Qian, G.; Yin, R. Application of Large Language Models in Medical Training Evaluation-Using ChatGPT as a Standardized Patient: Multimetric Assessment. Journal of medical Internet research. 2025;27:e59435.",Shool2025_supp_ref0638
Shool2025,10.1186/s12911-025-02954-4,639,2024,,,"Luo Z, Yuan C, Xie Q, Ananiadou S. Are Large Language Models True Healthcare Jacks-of-All-Trades? Benchmarking Across Health Professions Beyond Physician Exams. arXiv preprint arXiv:240611328. 2024.",Shool2025_supp_ref0639
Shool2025,10.1186/s12911-025-02954-4,640,2024,,,"Misra SMS, S. Artificial Intelligence and Objective Structured Clinical Examinations: Using ChatGPT to Revolutionize Clinical Skills Assessment in Medical Education. Journal of medical education and curricular development. 2024;11:23821205241263475.",Shool2025_supp_ref0640
Shool2025,10.1186/s12911-025-02954-4,641,2024,,,"Pavone MP, L.; Bizzarri, N.; Rosati, A.; Campolo, F.; Innocenzi, C.; Taliento, C.; Restaino, S.; Catena, U.; Vizzielli, G.; Akladios, C.; Ianieri, M. M.; Marescaux, J.; Campo, R.; Fanfani, F.; Scambia, G. Artificial Intelligence, the ChatGPT Large Language Model: Assessing the Accuracy of Responses to the Gynaecological Endoscopic Surgical Education and Assessment (GESEA) Level 1-2 knowledge tests. Facts, views & vision in ObGyn. 2024;16(4):449-56.",Shool2025_supp_ref0641
Shool2025,10.1186/s12911-025-02954-4,642,2024,,,"Shieh AT, B.; He, G.; Kumar, M.; Freed, J. A.; Majety, P. Assessing ChatGPT 4.0's test performance and clinical diagnostic accuracy on USMLE STEP 2 CK and clinical case reports. Scientific reports. 2024;14(1):9330.",Shool2025_supp_ref0642
Shool2025,10.1186/s12911-025-02954-4,643,2024,,,"Harb GEMRA, editor Assessing ChatGPT’s Accuracy in Dyslexia Inquiry. 2024 Medical Technologies Congress (TIPTEKNO); 2024 10-12 Oct. 2024.",Shool2025_supp_ref0643
