sr_id,sr_doi,refnum,year,doi,url,raw,bib_key
Shool2025,10.1186/s12911-025-02954-4,168,2024,,,"Abi-Rafeh JM, V. J.; Bassiri-Tehrani, B.; Marks, J.; Kazan, R.; Nahai, F. Complications Following Body Contouring: Performance Validation of Bard, a Novel AI Large Language Model, in Triaging and Managing Postoperative Patient Concerns. Aesthetic plastic surgery. 2024.",Shool2025_supp_ref0168
Shool2025,10.1186/s12911-025-02954-4,169,2023,,,"Lim BS, I.; Dooreemeah, D.; Lee, C. H. A. Delving into New Frontiers: assessing ChatGPT's proficiency in revealing uncharted dimensions of general surgery and pinpointing innovations for future advancements. Langenbeck's archives of surgery. 2023;408(1):446.",Shool2025_supp_ref0169
Shool2025,10.1186/s12911-025-02954-4,170,2024,,,"Mediboina AB, R. K.; Chodavarapu, S. Assessing the Accuracy of Information on Medication Abortion: A Comparative Analysis of ChatGPT and Google Bard AI. Cureus. 2024;16(1):e51544.",Shool2025_supp_ref0170
Shool2025,10.1186/s12911-025-02954-4,171,2023,,,"Lim ZWP, K.; Yew, S. M. E.; Lai, Y.; Sun, C. H.; Lam, J. S. H.; Chen, D. Z.; Goh, J. H. L.; Tan, M. C. J.; Sheng, B.; Cheng, C. Y.; Koh, V. T. C.; Tham, Y. C. Benchmarking large language models' performances for myopia care: a comparative analysis of ChatGPT-3.5, ChatGPT-4.0, and Google Bard. EBioMedicine. 2023;95:104770.",Shool2025_supp_ref0171
Shool2025,10.1186/s12911-025-02954-4,172,2023,,,"Peng ZM, R.; Zhang, Y.; Yan, M.; Lu, J.; Cheng, Q.; Liao, J.; Zhang, Y.; Wang, J.; Zhao, Y.; Zhu, J.; Qin, B.; Jiang, Q.; Shi, F.; Qian, J.; Chen, X.; Zhao, C. Development and evaluation of multimodal AI for diagnosis and triage of ophthalmic diseases using ChatGPT and anterior segment images: protocol for a two-stage cross-sectional study. Frontiers in artificial intelligence. 2023;6:1323924.",Shool2025_supp_ref0172
Shool2025,10.1186/s12911-025-02954-4,173,2023,,,"Rojas-Carabali WC-G, C.; Wei, X.; Putera, I.; Sen, A.; Thng, Z. X.; Agrawal, R.; Elze, T.; Sobrin, L.; Kempen, J. H.; Lee, B.; Biswas, J.; Nguyen, Q. D.; Gupta, V.; de-la-Torre, A.; Agrawal, R. Evaluating the Diagnostic Accuracy and Management Recommendations of ChatGPT in Uveitis. Ocular immunology and inflammation. 2023:1-6.",Shool2025_supp_ref0173
Shool2025,10.1186/s12911-025-02954-4,174,2024,,,"Fan Z, Tang J, Chen W, Wang S, Wei Z, Xi J, et al. Ai hospital: Interactive evaluation and collaboration of llms as intern doctors for clinical diagnosis. arXiv preprint arXiv:240209742. 2024.",Shool2025_supp_ref0174
Shool2025,10.1186/s12911-025-02954-4,175,2023,,,"Knebel DP, S.; Scherer, N.; Klaas, J.; Siedlecki, J.; Schworm, B. Assessment of ChatGPT in the Prehospital Management of Ophthalmological Emergencies - An Analysis of 10 Fictional Case Vignettes. Klinische Monatsblatter fur Augenheilkunde. 2023.",Shool2025_supp_ref0175
Shool2025,10.1186/s12911-025-02954-4,176,2024,,,"Saibene AMA, F.; Calvo-Henriquez, C.; Maniaci, A.; Mayo-Yáñez, M.; Paderno, A.; Vaira, L. A.; Felisati, G.; Craig, J. R. Reliability of large language models in managing odontogenic sinusitis clinical scenarios: a preliminary multidisciplinary evaluation. European archives of oto-rhino-laryngology : official journal of the European Federation of Oto-Rhino-Laryngological Societies (EUFOS) : affiliated with the German Society for Oto-Rhino-Laryngology - Head and Neck Surgery. 2024.",Shool2025_supp_ref0176
Shool2025,10.1186/s12911-025-02954-4,177,2023,,,"Frosolini AF, L.; Benedetti, S.; Vaira, L. A.; de Filippis, C.; Gennaro, P.; Marioni, G.; Gabriele, G. Assessing the accuracy of ChatGPT references in head and neck and ENT disciplines. European archives of oto-rhino-laryngology : official journal of the European Federation of Oto-Rhino-Laryngological Societies (EUFOS) : affiliated with the German Society for Oto-Rhino-Laryngology - Head and Neck Surgery. 2023;280(11):5129-33.",Shool2025_supp_ref0177
Shool2025,10.1186/s12911-025-02954-4,178,2023,,,"Leypold TS, B.; Boos, A.; Beier, J. P. Can AI Think Like a Plastic Surgeon? Evaluating GPT-4's Clinical Judgment in Reconstructive Procedures of the Upper Extremity. PLASTIC AND RECONSTRUCTIVE SURGERY-GLOBAL OPEN. 2023;11(12).",Shool2025_supp_ref0178
Shool2025,10.1186/s12911-025-02954-4,179,2023,,,"Caglar UY, O.; Fırat Ozervarli, M.; Aydin, R.; Sarilar, O.; Ozgor, F.; Ortac, M. Assessing the Performance of Chat Generative Pretrained Transformer (ChatGPT) in Answering Andrology-Related Questions. Urol Res Pract. 2023;49(6):365-9.",Shool2025_supp_ref0179
Shool2025,10.1186/s12911-025-02954-4,180,2023,,,"Golan RR, S. J.; Reddy, R.; Loloi, J.; Bernstein, A. P.; Connelly, Z. M.; Golan, N. S.; Ramasamy, R. ChatGPT's Ability to Assess Quality and Readability of Online Medical Information: Evidence From a Cross-Sectional Study. Cureus. 2023;15(7):e42214.",Shool2025_supp_ref0180
Shool2025,10.1186/s12911-025-02954-4,181,2023,,,"Caglar UY, O.; Meric, A.; Ayranci, A.; Gelmis, M.; Sarilar, O.; Ozgor, F. Evaluating the performance of ChatGPT in answering questions related to pediatric urology. Journal of pediatric urology. 2023.",Shool2025_supp_ref0181
Shool2025,10.1186/s12911-025-02954-4,182,2022,,,"Tan XY, C.; Wu, H.; Zhao, X., editor Comprehensive Evaluation of BERT Model for DNA-Language for Prediction of DNA Sequence Binding Specificities in Fine-Tuning Phase. Lecture Notes in Computer Science (including subseries Lecture Notes in Artificial Intelligence and Lecture Notes in Bioinformatics); 2022: Springer Science and Business Media Deutschland GmbH.",Shool2025_supp_ref0182
Shool2025,10.1186/s12911-025-02954-4,183,2023,,,"Groves E, Wang M, Abdulle Y, Kunz H, Hoelscher-Obermaier J, Wu R, et al. Benchmarking and Analyzing In-context Learning, Fine-tuning and Supervised Learning for Biomedical Knowledge Curation: a focused study on chemical entities of biological interest. arXiv preprint arXiv:231212989. 2023.",Shool2025_supp_ref0183
Shool2025,10.1186/s12911-025-02954-4,184,2022,,,"Mahor KM, A. K., editor Public Sentiment Assessment of Coronavirus-Specific Tweets using a Transformer-based BERT Classifier. International Conference on Edge Computing and Applications, ICECAA 2022 - Proceedings; 2022: Institute of Electrical and Electronics Engineers Inc.",Shool2025_supp_ref0184
Shool2025,10.1186/s12911-025-02954-4,185,2023,,,"Tang J, Wang K, Hu H, Zhang X, Wang P, Liu X, et al. ALPHA: AnomaLous Physiological Health Assessment Using Large Language Models. arXiv preprint arXiv:231112524. 2023.",Shool2025_supp_ref0185
Shool2025,10.1186/s12911-025-02954-4,186,2021,,,"Wen AE, M. Y.; Moon, S.; Fan, J. Adapting and evaluating a deep learning language model for clinical why-question answering. JAMIA Open. 2021;3(1):16-20.",Shool2025_supp_ref0186
Shool2025,10.1186/s12911-025-02954-4,187,2023,,,"Kaur N, Choudhury M, Pruthi D. Evaluating Large Language Models for Health-related Queries with Presuppositions. arXiv preprint arXiv:231208800. 2023.",Shool2025_supp_ref0187
Shool2025,10.1186/s12911-025-02954-4,188,2023,,,"Savage TW, J.; Shieh, L. A Large Language Model Screening Tool to Target Patients for Best Practice Alerts: Development and Validation. JMIR medical informatics. 2023;11:e49886.",Shool2025_supp_ref0188
Shool2025,10.1186/s12911-025-02954-4,189,2024,,,"Adams L, Busch F, Han T, Excoffier J-B, Ortala M, Löser A, et al. LongHealth: A Question Answering Benchmark with Long Clinical Documents. arXiv preprint arXiv:240114490. 2024.",Shool2025_supp_ref0189
Shool2025,10.1186/s12911-025-02954-4,190,2022,,,"Meaney C, Hakimpour W, Kalia S, Moineddin R. A Comparative Evaluation Of Transformer Models For De-Identification Of Clinical Text Data. arXiv preprint arXiv:220407056. 2022.",Shool2025_supp_ref0190
Shool2025,10.1186/s12911-025-02954-4,191,2023,,https://ui.adsabs.harvard.edu/abs/2023arXiv230516326C,"Chen Q, Du J, Hu Y, Kuttichi Keloth V, Peng X, Raja K, et al. Large language models in biomedical natural language processing: benchmarks, baselines, and recommendations2023 May 01, 2023:[arXiv:2305.16326 p.]. Available from: https://ui.adsabs.harvard.edu/abs/2023arXiv230516326C.",Shool2025_supp_ref0191
Shool2025,10.1186/s12911-025-02954-4,192,2021,,https://ui.adsabs.harvard.edu/abs/2021arXiv210704374N,"Naseem U, Dunn AG, Khushi M, Kim J. Benchmarking for Biomedical Natural Language Processing Tasks with a Domain Specific ALBERT2021 July 01, 2021:[arXiv:2107.04374 p.]. Available from: https://ui.adsabs.harvard.edu/abs/2021arXiv210704374N.",Shool2025_supp_ref0192
Shool2025,10.1186/s12911-025-02954-4,193,2024,,,"Chen SL, Y.; Lu, S.; Van, H.; Aerts, Hjwl; Savova, G. K.; Bitterman, D. S. Evaluating the ChatGPT family of models for biomedical reasoning and classification. Journal of the American Medical Informatics Association : JAMIA. 2024.",Shool2025_supp_ref0193
Shool2025,10.1186/s12911-025-02954-4,194,2021,,,"Kades KS, J.; Koehler, G.; Full, P. M.; Emmy Lai, T. Y.; Kleesiek, J.; Maier-Hein, K. H. Adapting Bidirectional Encoder Representations from Transformers (BERT) to assess clinical semantic textual similarity: Algorithm development and validation study. JMIR Med Inform. 2021;9(2).",Shool2025_supp_ref0194
Shool2025,10.1186/s12911-025-02954-4,195,2024,,,"Pressman SMB, S.; Gomez-Cabello, C. A.; Haider, S. A.; Forte, A. J. AI in Hand Surgery: Assessing Large Language Models in the Classification and Management of Hand Injuries. Journal of clinical medicine. 2024;13(10).",Shool2025_supp_ref0195
Shool2025,10.1186/s12911-025-02954-4,196,2021,,https://ui.adsabs.harvard.edu/abs/2021arXiv211108088R,"Robinson R. Assessing gender bias in medical and scientific masked language models with StereoSet2021 November 01, 2021:[arXiv:2111.08088 p.]. Available from: https://ui.adsabs.harvard.edu/abs/2021arXiv211108088R.",Shool2025_supp_ref0196
Shool2025,10.1186/s12911-025-02954-4,197,2023,,,"Al-Ashwal FYZ, M.; Gharaibeh, L.; Abu-Farha, R.; Bitar, A. N. Evaluating the Sensitivity, Specificity, and Accuracy of ChatGPT-3.5, ChatGPT-4, Bing AI, and Bard Against Conventional Drug-Drug Interactions Clinical Tools. Drug, healthcare and patient safety. 2023;15:137-47.",Shool2025_supp_ref0197
Shool2025,10.1186/s12911-025-02954-4,198,2023,,,"Rao AP, M.; Kim, J.; Kamineni, M.; Lie, W.; Prasad, A. K.; Landman, A.; Dreyer, K. J.; Succi, M. D. Assessing the Utility of ChatGPT Throughout the Entire Clinical Workflow. medRxiv. 2023.",Shool2025_supp_ref0198
Shool2025,10.1186/s12911-025-02954-4,199,2022,,https://ui.adsabs.harvard.edu/abs/2022arXiv220303547A,"Abaho M, Bollegala D, Williamson PR, Dodd S. Assessment of contextualised representations in detecting outcome phrases in clinical trials2022 February 01, 2022:[arXiv:2203.03547 p.]. Available from: https://ui.adsabs.harvard.edu/abs/2022arXiv220303547A.",Shool2025_supp_ref0199
Shool2025,10.1186/s12911-025-02954-4,200,2024,,,"Ni ZQ, Y.; Vaillant, P.; Jaulent, M. C.; Bousquet, C., editor Assessing ChatGPT's Performance in Health Fact-Checking: Performance, Biases, and Risks. Communications in Computer and Information Science; 2024: Springer Science and Business Media Deutschland GmbH.",Shool2025_supp_ref0200
Shool2025,10.1186/s12911-025-02954-4,201,2021,,,"Xia YL, D.; Zhang, J.; Li, K. BERT-based automated risk of bias assessment. Chin J Evid-Based Med. 2021;21(2):204-9.",Shool2025_supp_ref0201
Shool2025,10.1186/s12911-025-02954-4,202,2021,,,"Roshanzamir AA, H.; Baghshah, M. S. Transformer-based deep neural network language models for Alzheimer's disease risk assessment from targeted speech. BMC MEDICAL INFORMATICS AND DECISION MAKING. 2021;21(1).",Shool2025_supp_ref0202
Shool2025,10.1186/s12911-025-02954-4,203,2024,,https://ui.adsabs.harvard.edu/abs/2024arXiv240201751T,"T BB, Chen J-M. Performance Assessment of ChatGPT vs Bard in Detecting Alzheimer's Dementia2024 January 01, 2024:[arXiv:2402.01751 p.]. Available from: https://ui.adsabs.harvard.edu/abs/2024arXiv240201751T.",Shool2025_supp_ref0203
Shool2025,10.1186/s12911-025-02954-4,204,2023,,,"Owen DA, D.; Hassoulas, A.; Pardiñas, A. F.; Espinosa-Anke, L.; Collados, J. C. Enabling Early Health Care Intervention by Detecting Depression in Users of Web-Based Forums using Language Models: Longitudinal Analysis and Evaluation. Jmir ai. 2023;2:e41205.",Shool2025_supp_ref0204
Shool2025,10.1186/s12911-025-02954-4,205,2019,,https://ui.adsabs.harvard.edu/abs/2019arXiv190702581H,"Howard D, Maslej M, Lee J, Ritchie J, Woollard G, French L. Transfer Learning for Risk Classification of Social Media Posts: Model Evaluation Study2019 July 01, 2019:[arXiv:1907.02581 p.]. Available from: https://ui.adsabs.harvard.edu/abs/2019arXiv190702581H.",Shool2025_supp_ref0205
Shool2025,10.1186/s12911-025-02954-4,206,2022,,,"Benítez-Andrades JAA-P, J. M.; Vidal, M. E.; Pastor-Vargas, R.; García-Ordas, M. T. Traditional Machine Learning Models and Bidirectional Encoder Representations From Transformer (BERT)-Based Automatic Classification of Tweets About Eating Disorders: Algorithm Development and Validation Study. JMIR Med Inform. 2022;10(2).",Shool2025_supp_ref0206
Shool2025,10.1186/s12911-025-02954-4,207,2023,,https://ui.adsabs.harvard.edu/abs/2023arXiv230315727L,"Lamichhane B. Evaluation of ChatGPT for NLP-based Mental Health Applications2023 March 01, 2023:[arXiv:2303.15727 p.]. Available from: https://ui.adsabs.harvard.edu/abs/2023arXiv230315727L.",Shool2025_supp_ref0207
Shool2025,10.1186/s12911-025-02954-4,208,2023,,,"Nguyen DS, D.; Newbury, A.; Kim, Y. H. Evaluation of ChatGPT and Google Bard Using Prompt Engineering in Cancer Screening Algorithms. Academic radiology. 2023.",Shool2025_supp_ref0208
Shool2025,10.1186/s12911-025-02954-4,209,2024,,,"Desseauve DL, R.; de la Fourniere, B.; Ceccaldi, P. F.; Dziadzko, M. AI in obstetrics: Evaluating residents' capabilities and interaction strategies with ChatGPT. European journal of obstetrics, gynecology, and reproductive biology. 2024;302:238-41.",Shool2025_supp_ref0209
Shool2025,10.1186/s12911-025-02954-4,210,2023,,,"Mithun SJ, A. K.; Sherkhane, U. B.; Jaiswar, V.; Purandare, N. C.; Rangarajan, V.; Dekker, A.; Puts, S.; Bermejo, I.; Wee, L. Development and validation of deep learning and BERT models for classification of lung cancer radiology reports. Inform Med Unlocked. 2023;40.",Shool2025_supp_ref0210
Shool2025,10.1186/s12911-025-02954-4,211,2023,,,"Yanagita YY, D.; Uchida, S.; Tawara, J.; Ikusaka, M. Accuracy of ChatGPT on Medical Questions in the National Medical Licensing Examination in Japan: Evaluation Study. JMIR formative research. 2023;7:e48023.",Shool2025_supp_ref0211
Shool2025,10.1186/s12911-025-02954-4,212,2023,,,"Rosol MG, J. S.; Laba, J.; Korzeniewski, K.; Mlynczak, M. Evaluation of the performance of GPT-3.5 and GPT-4 on the Polish Medical Final Examination. SCIENTIFIC REPORTS. 2023;13(1).",Shool2025_supp_ref0212
Shool2025,10.1186/s12911-025-02954-4,213,2023,,,"Oh NC, G. S.; Lee, W. Y. ChatGPT goes to the operating room: evaluating GPT-4 performance and its potential in surgical education and training in the era of large language models. Annals of surgical treatment and research. 2023;104(5):269-73.",Shool2025_supp_ref0213
Shool2025,10.1186/s12911-025-02954-4,214,2023,,,"Fang CW, Y.; Fu, W.; Ling, J.; Wang, Y.; Liu, X.; Jiang, Y.; Wu, Y.; Chen, Y.; Zhou, J.; Zhu, Z.; Yan, Z.; Yu, P.; Liu, X. How does ChatGPT-4 preform on non-English national medical licensing examination? An evaluation in Chinese language. PLOS digital health. 2023;2(12):e0000397.",Shool2025_supp_ref0214
Shool2025,10.1186/s12911-025-02954-4,215,2023,,https://ui.adsabs.harvard.edu/abs/2023arXiv230318027K,"Kasai J, Kasai Y, Sakaguchi K, Yamada Y, Radev D. Evaluating GPT-4 and ChatGPT on Japanese Medical Licensing Examinations2023 March 01, 2023:[arXiv:2303.18027 p.]. Available from: https://ui.adsabs.harvard.edu/abs/2023arXiv230318027K.",Shool2025_supp_ref0215
Shool2025,10.1186/s12911-025-02954-4,216,2023,,,"Ebrahimian MB, B.; Ghayebi, N.; Sobhrakhshankhah, E. ChatGPT in Iranian medical licensing examination: evaluating the diagnostic accuracy and decision-making capabilities of an AI-based model. BMJ health & care informatics. 2023;30(1).",Shool2025_supp_ref0216
Shool2025,10.1186/s12911-025-02954-4,217,2023,,,"Guillen-Grima FG-A, S.; Guillen-Aguinaga, L.; Alas-Brun, R.; Onambele, L.; Ortega, W.; Montejo, R.; Aguinaga-Ontoso, E.; Barach, P.; Aguinaga-Ontoso, I. Evaluating the Efficacy of ChatGPT in Navigating the Spanish Medical Residency Entrance Examination (MIR): Promising Horizons for AI in Clinical Medicine. Clinics and practice. 2023;13(6):1460-87.",Shool2025_supp_ref0217
Shool2025,10.1186/s12911-025-02954-4,218,2023,,,"Lukac SD, D.; Fink, V.; Leinert, E.; Hartkopf, A.; Veselinovic, K.; Janni, W.; Rack, B.; Pfister, K.; Heitmeir, B.; Ebner, F. Evaluating ChatGPT as an adjunct for the multidisciplinary tumor board decision-making in primary breast cancer cases. Archives of gynecology and obstetrics. 2023;308(6):1831-44.",Shool2025_supp_ref0218
Shool2025,10.1186/s12911-025-02954-4,219,2023,,,"Madrid-García AR-R, Z.; Freites-Nuñez, D.; Pérez-Sancristóbal, I.; Pato-Cour, E.; Plasencia-Rodríguez, C.; Cabeza-Osorio, L.; Abasolo-Alcázar, L.; León-Mateos, L.; Fernández-Gutiérrez, B.; Rodríguez-Rodríguez, L. Harnessing ChatGPT and GPT-4 for evaluating the rheumatology questions of the Spanish access exam to specialized medical training. Scientific reports. 2023;13(1):22129.",Shool2025_supp_ref0219
Shool2025,10.1186/s12911-025-02954-4,220,2023,,,"Panthier CG, D. Success of ChatGPT, an AI language model, in taking the French language version of the European Board of Ophthalmology examination: A novel approach to medical knowledge assessment. Journal francais d'ophtalmologie. 2023;46(7):706-11.",Shool2025_supp_ref0220
Shool2025,10.1186/s12911-025-02954-4,221,2023,,,"Buhr CRS, H.; Huppertz, T.; Bahr-Hamm, K.; Matthias, C.; Blaikie, A.; Kelsey, T.; Kuhn, S.; Eckrich, J. ChatGPT Versus Consultants: Blinded Evaluation on Answering Otorhinolaryngology Case-Based Questions. JMIR medical education. 2023;9:e49183.",Shool2025_supp_ref0221
Shool2025,10.1186/s12911-025-02954-4,222,2024,,,"Kim HWS, D. H.; Kim, J.; Lee, G. H.; Cho, J. W. Assessing the performance of ChatGPT's responses to questions related to epilepsy: A cross-sectional study on natural language processing and medical information retrieval. Seizure. 2024;114:1-8.",Shool2025_supp_ref0222
Shool2025,10.1186/s12911-025-02954-4,223,2024,,,"Soto-Chávez MJB, M. M.; Fernández-Avila, D. G.; Muñoz, O. M. Evaluation of information provided to patients by ChatGPT about chronic diseases in Spanish language. DIGITAL HEALTH. 2024;10.",Shool2025_supp_ref0223
Shool2025,10.1186/s12911-025-02954-4,224,2024,,,"Toyama YH, A.; Abe, M.; Nagano, M.; Kawabata, M.; Seki, Y.; Takase, K. Performance evaluation of ChatGPT, GPT-4, and Bard on the official board examination of the Japan Radiology Society. Japanese journal of radiology. 2024;42(2):201-7.",Shool2025_supp_ref0224
Shool2025,10.1186/s12911-025-02954-4,225,2024,,,"Ben Haim GB, A.; Eden, H.; Burshtein, L.; Barash, Y.; Irony, A.; Klang, E. AI in the ED: Assessing the efficacy of GPT models vs. physicians in medical score calculation. Am J Emerg Med. 2024;79:161-6.",Shool2025_supp_ref0225
Shool2025,10.1186/s12911-025-02954-4,226,2023,,https://ui.adsabs.harvard.edu/abs/2023arXiv230507340X,"Xu J, Lu L, Yang S, Liang B, Peng X, Pang J, et al. MedGPTEval: A Dataset and Benchmark to Evaluate Responses of Large Language Models in Medicine2023 May 01, 2023:[arXiv:2305.07340 p.]. Available from: https://ui.adsabs.harvard.edu/abs/2023arXiv230507340X.",Shool2025_supp_ref0226
Shool2025,10.1186/s12911-025-02954-4,227,2024,,,"Abdelgadir YT, C.; Miao, J.; Suppadungsuk, S.; Pham, J. H.; Mao, M. A.; Craici, I. M.; Cheungpasitporn, W. AI integration in nephrology: evaluating ChatGPT for accurate ICD-10 documentation and coding. Frontiers in artificial intelligence. 2024;7:1457586.",Shool2025_supp_ref0227
Shool2025,10.1186/s12911-025-02954-4,228,2023,,,"Homburg MM, E.; Berends, M.; Kupers, T.; Hartman, T. O.; Muris, J.; de Schepper, E.; Velek, P.; Kuiper, J.; Berger, M.; Peters, L. A Natural Language Processing Model for COVID-19 Detection Based on Dutch General Practice Electronic Health Records by Using Bidirectional Encoder Representations From Transformers: Development and Validation Study. J Med Internet Res. 2023;25(1).",Shool2025_supp_ref0228
Shool2025,10.1186/s12911-025-02954-4,229,2023,,,"Hirosawa TK, R.; Harada, Y.; Mizuta, K.; Tokumasu, K.; Kaji, Y.; Suzuki, T.; Shimizu, T. ChatGPT-Generated Differential Diagnosis Lists for Complex Case–Derived Clinical Vignettes: Diagnostic Accuracy Evaluation. JMIR Med Inform. 2023;11.",Shool2025_supp_ref0229
Shool2025,10.1186/s12911-025-02954-4,230,2022,,https://ui.adsabs.harvard.edu/abs/2022arXiv220413535M,"Mosteiro P, Rijcken E, Zervanou K, Kaymak U, Scheepers F, Spruit M. Machine Learning for Violence Risk Assessment Using Dutch Clinical Notes2022 April 01, 2022:[arXiv:2204.13535 p.]. Available from: https://ui.adsabs.harvard.edu/abs/2022arXiv220413535M.",Shool2025_supp_ref0230
Shool2025,10.1186/s12911-025-02954-4,231,2024,,,"Núñez ABGPACTRP, editor AI-Enhanced Social Robots for Older Adults Care: Evaluating the Efficacy of ChatGPT-Powered Storytelling in the EBO Platform. 2024 33rd IEEE International Conference on Robot and Human Interactive Communication (ROMAN); 2024 26-30 Aug. 2024.",Shool2025_supp_ref0231
Shool2025,10.1186/s12911-025-02954-4,232,2024,,,"Mensah PBQ, N. S.; Dagadu, S.; Mensah, J. K.; Darkwah, J. D., editor All You Need Is Context: Clinician Evaluations of various iterations of a Large Language Model-Based First Aid Decision Support Tool in Ghana. Proceedings - 2024 IEEE 12th International Conference on Healthcare Informatics, ICHI 2024; 2024: Institute of Electrical and Electronics Engineers Inc.",Shool2025_supp_ref0232
Shool2025,10.1186/s12911-025-02954-4,233,2024,,,"Wei KF, C.; Rajasekaran, K. Answering head and neck cancer questions: An assessment of ChatGPT responses. American journal of otolaryngology. 2024;45(1):7.",Shool2025_supp_ref0233
Shool2025,10.1186/s12911-025-02954-4,234,2024,,,"Wang LCZ, H.; Ginsberg, N.; Nandorine Ban, A.; Kooman, J. P.; Kotanko, P. Application of ChatGPT to Support Nutritional Recommendations for Dialysis Patients - A Qualitative and Quantitative Evaluation. Journal of renal nutrition : the official journal of the Council on Renal Nutrition of the National Kidney Foundation. 2024;34(6):477-81.",Shool2025_supp_ref0234
Shool2025,10.1186/s12911-025-02954-4,235,2025,,,"Bannett YG, F.; Pillai, M.; Herrmann, J. E.; Luo, I.; Huffman, L. C.; Feldman, H. M. Applying Large Language Models to Assess Quality of Care: Monitoring ADHD Medication Side Effects. Pediatrics. 2025;155(1).",Shool2025_supp_ref0235
Shool2025,10.1186/s12911-025-02954-4,236,2024,,,"Gomez-Cabello CAB, S.; Pressman, S. M.; Haider, S. A.; Sehgal, A.; Leibovich, B. C.; Forte, A. J. Artificial Intelligence in Postoperative Care: Assessing Large Language Models for Patient Recommendations in Plastic Surgery. Healthcare (Basel, Switzerland). 2024;12(11).",Shool2025_supp_ref0236
Shool2025,10.1186/s12911-025-02954-4,237,2024,,,"Erden YT, M. H.; Bagcier, F. Artificial intelligence insights into osteoporosis: assessing ChatGPT's information quality and readability. Arch Osteoporos. 2024;19(1):8.",Shool2025_supp_ref0237
Shool2025,10.1186/s12911-025-02954-4,238,2024,,,"Li LTA, J. M.; Sinkler, M. A.; Mistovich, R. J. Artificial Intelligence Promotes the Dunning Kruger Effect: Evaluating ChatGPT Answers to Frequently Asked Questions About Adolescent Idiopathic Scoliosis. The Journal of the American Academy of Orthopaedic Surgeons. 2024.",Shool2025_supp_ref0238
Shool2025,10.1186/s12911-025-02954-4,239,2024,,,"Magruder MLR, A. N.; Wong, J. C. J.; Erez, O.; Piuzzi, N. S.; Scuderi, G. R.; Slover, J. D.; Oh, J. H.; Schwarzkopf, R.; Chen, A. F.; Iorio, R.; Goodman, S. B.; Mont, M. A. Assessing Ability for ChatGPT to Answer Total Knee Arthroplasty-Related Questions. The Journal of arthroplasty. 2024;39(8):2022-7.",Shool2025_supp_ref0239
Shool2025,10.1186/s12911-025-02954-4,240,2024,,,"Hu YL, Y.; Liao, F.; Shu, X.; Zhu, Y.; Du, Y. Q.; Lu, N. H. Assessing Accuracy of ChatGPT on Addressing Helicobacter pylori Infection-Related Questions: A National Survey and Comparative Study. Helicobacter. 2024;29(4):e13116.",Shool2025_supp_ref0240
Shool2025,10.1186/s12911-025-02954-4,241,2024,,,"Wang G, Ran J, Tang R, Chang C-Y, Chuang Y-N, Liu Z, et al. Assessing and enhancing large language models in rare disease question-answering. arXiv preprint arXiv:240808422. 2024.",Shool2025_supp_ref0241
Shool2025,10.1186/s12911-025-02954-4,242,2024,,,"Doddi SH, T.; Salichs, O.; Bera, K.; Tippareddy, C.; Ramaiya, N.; Tirumani, S. H. Assessing appropriate responses to ACR urologic imaging scenarios using ChatGPT and Bard. Current problems in diagnostic radiology. 2024;53(2):226-9.",Shool2025_supp_ref0242
Shool2025,10.1186/s12911-025-02954-4,243,2024,,,"Shayegh NAB, D.; Griffiths, Y.; Coleman, P. W.; Deane, L. A.; Tonkin, J. Assessing artificial intelligence responses to common patient questions regarding inflatable penile prostheses using a publicly available natural language processing tool (ChatGPT). The Canadian journal of urology. 2024;31(3):11880-5.",Shool2025_supp_ref0243
Shool2025,10.1186/s12911-025-02954-4,244,2024,,,"Dodhia PM, S.; Moallem, G.; Rubin, D.; Bean, G.; Rusu, M., editor Assessing breast cancer chemotherapy response in radiology and pathology reports via a Large Language Model. Conference on Medical Imaging - Imaging Informatics for Healthcare, Research, and Applications; 2024 Feb 19-21; San Diego, CA. BELLINGHAM: Spie-Int Soc Optical Engineering; 2024.",Shool2025_supp_ref0244
