sr_id,sr_doi,refnum,year,doi,url,raw,bib_key
Shool2025,10.1186/s12911-025-02954-4,1,2023,,,"Chan C, You K, Chung S, Giuffrè M, Saarinen T, Rajashekar N, et al. Assessing the Usability of GutGPT: A Simulation Study of an AI Clinical Decision Support System for Gastrointestinal Bleeding Risk. arXiv preprint arXiv:231210072. 2023.",Shool2025_supp_ref0001
Shool2025,10.1186/s12911-025-02954-4,2,2023,,,"Cross JR, R.; Devaraju, S.; Vaughans, A.; Hood, R.; Kayalackakom, T.; Honnavar, P.; Naik, S.; Sebastian, R. Transforming Medical Education: Assessing the Integration of ChatGPT Into Faculty Workflows at a Caribbean Medical School. Cureus. 2023;15(7):e41399.",Shool2025_supp_ref0002
Shool2025,10.1186/s12911-025-02954-4,3,2023,,,"Han ZB, F.; Udaiyar, A.; Fooks, A.; Terlecky, S. R. An explorative assessment of ChatGPT as an aid in medical education: Use it with caution. Medical teacher. 2023:1-8.",Shool2025_supp_ref0003
Shool2025,10.1186/s12911-025-02954-4,4,2023,,,"Morjaria LB, L.; Bracken, K.; Ngo, Q. N.; Lee, M.; Levinson, A. J.; Smith, J.; Thompson, P.; Sibbald, M. Examining the Threat of ChatGPT to the Validity of Short Answer Assessments in an Undergraduate Medical Program. Journal of medical education and curricular development. 2023;10:23821205231204178.",Shool2025_supp_ref0004
Shool2025,10.1186/s12911-025-02954-4,5,2023,,,"Brin DS, V.; Vaid, A.; Soroush, A.; Glicksberg, B. S.; Charney, A. W.; Nadkarni, G.; Klang, E. Comparing ChatGPT and GPT-4 performance in USMLE soft skill assessments. Scientific reports. 2023;13(1):16492.",Shool2025_supp_ref0005
Shool2025,10.1186/s12911-025-02954-4,6,2024,,,"Yaneva VB, P.; Jurich, D. P.; Swygert, K.; Clauser, B. E. Examining ChatGPT Performance on USMLE Sample Items and Implications for Assessment. Academic medicine : journal of the Association of American Medical Colleges. 2024;99(2):192-7.",Shool2025_supp_ref0006
Shool2025,10.1186/s12911-025-02954-4,7,2023,,,"Meo SAA-M, A. A.; Alotaibi, M.; Meo, M. Z. S.; Meo, M. O. S. ChatGPT Knowledge Evaluation in Basic and Clinical Medical Sciences: Multiple Choice Question Examination-Based Performance. Healthcare (Basel, Switzerland). 2023;11(14).",Shool2025_supp_ref0007
Shool2025,10.1186/s12911-025-02954-4,8,2023,,,"Zuckerman MF, R.; Tan, R. J. B.; Kelp, N.; Ecker, D. J.; Menke, J.; Lockspeiser, T. ChatGPT for assessment writing. Medical teacher. 2023;45(11):1224-7.",Shool2025_supp_ref0008
Shool2025,10.1186/s12911-025-02954-4,9,2023,,,"Chen TCM, E.; Kearns, P.; Delashaw, J.; Dumont, A.; Maraganore, D.; Wang, A. Assessment of ChatGPT's performance on neurology written board examination questions. BMJ neurology open. 2023;5(2):e000530.",Shool2025_supp_ref0009
Shool2025,10.1186/s12911-025-02954-4,10,2024,,,"Wang AYL, S.; Tran, C.; Homer, R. J.; Wilsdon, D.; Walsh, J. C.; Goebel, E. A.; Sansano, I.; Sonawane, S.; Cockenpot, V.; Mukhopadhyay, S.; Taskin, T.; Zahra, N.; Cima, L.; Semerci, O.; Özamrak, B. G.; Mishra, P.; Vennavalli, N. S.; Chen, P. C.; Cecchini, M. J. Assessment of Pathology Domain-Specific Knowledge of ChatGPT and Comparison to Human Performance. Archives of pathology & laboratory medicine. 2024.",Shool2025_supp_ref0010
Shool2025,10.1186/s12911-025-02954-4,11,2023,,,"Geetha SDK, A.; Khan, A.; Kannadath, B. S.; Vitkovski, T. Evaluation of ChatGPT pathology knowledge using board-style questions. American journal of clinical pathology. 2023.",Shool2025_supp_ref0011
Shool2025,10.1186/s12911-025-02954-4,12,2024,,,"Herrmann-Werner AF-W, T.; Holderried, F.; Herschbach, L.; Griewatz, J.; Masters, K.; Zipfel, S.; Mahling, M. Assessing ChatGPT's Mastery of Bloom's Taxonomy Using Psychosomatic Medicine Exam Questions: Mixed-Methods Study. Journal of medical Internet research. 2024;26:e52113.",Shool2025_supp_ref0012
Shool2025,10.1186/s12911-025-02954-4,13,2023,,,"Elyoseph ZH-S, D.; Asraf, K.; Lvovsky, M. ChatGPT outperforms humans in emotional awareness evaluations. Frontiers in psychology. 2023;14:1199058.",Shool2025_supp_ref0013
Shool2025,10.1186/s12911-025-02954-4,14,2023,,,"Huang Y, Gomaa A, Semrau S, Haderlein M, Lettmaier S, Weissmann T, et al. Benchmarking ChatGPT-4 on ACR radiation oncology in-training (TXIT) exam and red journal gray zone cases: Potentials and challenges for AI-assisted medical education and decision making in radiation oncology. arXiv preprint arXiv:230411957. 2023.",Shool2025_supp_ref0014
Shool2025,10.1186/s12911-025-02954-4,15,2023,,,"Huang YG, A.; Semrau, S.; Haderlein, M.; Lettmaier, S.; Weissmann, T.; Grigo, J.; Tkhayat, H. B.; Frey, B.; Gaipl, U.; Distel, L.; Maier, A.; Fietkau, R.; Bert, C.; Putz, F. Benchmarking ChatGPT-4 on a radiation oncology in-training exam and Red Journal Gray Zone cases: potentials and challenges for ai-assisted medical education and decision making in radiation oncology. Frontiers in oncology. 2023;13:1265024.",Shool2025_supp_ref0015
Shool2025,10.1186/s12911-025-02954-4,16,2023,,,"Patil NSH, R. S.; van der Pol, C. B.; Larocque, N. Comparative Performance of ChatGPT and Bard in a Text-Based Radiology Knowledge Assessment. Canadian Association of Radiologists journal = Journal l'Association canadienne des radiologistes. 2023:8465371231193716.",Shool2025_supp_ref0016
Shool2025,10.1186/s12911-025-02954-4,17,2023,,,"Sarangi PKN, R. K.; Mohakud, S.; Vats, A.; Sahani, D.; Mondal, H. Assessing the Capability of ChatGPT, Google Bard, and Microsoft Bing in Solving Radiology Case Vignettes. Indian J Radiol Imaging. 2023.",Shool2025_supp_ref0017
Shool2025,10.1186/s12911-025-02954-4,18,2024,,,"Beaulieu-Jones BRB, M. T.; Shah, S.; Marwaha, J. S.; Lai, S. L.; Brat, G. A. Evaluating capabilities of large language models: Performance of GPT-4 on surgical knowledge assessments. Surgery. 2024.",Shool2025_supp_ref0018
Shool2025,10.1186/s12911-025-02954-4,19,2023,,,"Mannam SSS, R.; Chauhan, D.; Ahmad, H. S.; Matache, I. M.; Bryan, K.; Chitta, S. V. K.; Bathula, S. C.; Turlip, R.; Wathen, C.; Ghenbot, Y.; Ajmera, S.; Blue, R.; Chen, H. I.; Ali, Z. S.; Malhotra, N.; Srinivasan, V.; Ozturk, A. K.; Yoon, J. W. Large Language Model-Based Neurosurgical Evaluation Matrix: A Novel Scoring Criteria to Assess the Efficacy of ChatGPT as an Educational Tool for Neurosurgery Board Preparation. World neurosurgery. 2023;180:e765-e73.",Shool2025_supp_ref0019
Shool2025,10.1186/s12911-025-02954-4,20,2023,,,"Holmes J, Peng R, Li Y, Hu J, Liu Z, Wu Z, et al. Evaluating multiple large language models in pediatric ophthalmology. arXiv preprint arXiv:231104368. 2023.",Shool2025_supp_ref0020
Shool2025,10.1186/s12911-025-02954-4,21,2023,,,"Taloni AB, M.; Scarsi, V.; Rossi, C.; Coco, G.; Scorcia, V.; Giannaccare, G. Comparative performance of humans versus GPT-4.0 and GPT-3.5 in the self-assessment program of American Academy of Ophthalmology. Scientific reports. 2023;13(1):18562.",Shool2025_supp_ref0021
Shool2025,10.1186/s12911-025-02954-4,22,2023,,https://ui.adsabs.harvard.edu/abs/2023arXiv231104933H,"Holmes J, Ye S, Li Y, Wu S-N, Liu Z, Wu Z, et al. Evaluating Large Language Models in Ophthalmology2023 November 01, 2023:[arXiv:2311.04933 p.]. Available from: https://ui.adsabs.harvard.edu/abs/2023arXiv231104933H.",Shool2025_supp_ref0022
Shool2025,10.1186/s12911-025-02954-4,23,2024,,,"Jain NG, C.; Fisher, J.; Campano, D.; Winston, T. Assessing ChatGPT's orthopedic in-service training exam performance and applicability in the field. Journal of orthopaedic surgery and research. 2024;19(1):27.",Shool2025_supp_ref0023
Shool2025,10.1186/s12911-025-02954-4,24,2023,,,"Massey PAM, C.; Zhang, A. S. Comparison of ChatGPT-3.5, ChatGPT-4, and Orthopaedic Resident Performance on Orthopaedic Assessment Examinations. The Journal of the American Academy of Orthopaedic Surgeons. 2023;31(23):1173-9.",Shool2025_supp_ref0024
Shool2025,10.1186/s12911-025-02954-4,25,2024,,,"Long CL, K.; Zhang, J.; Santos, A. D.; Alanazi, A.; O'Brien, D.; Wright, E. D.; Cote, D. A Novel Evaluation Model for Assessing ChatGPT on Otolaryngology-Head and Neck Surgery Certification Examinations: Performance Study. JMIR medical education. 2024;10:e49970.",Shool2025_supp_ref0025
Shool2025,10.1186/s12911-025-02954-4,26,2023,,,"Zalzal HGC, J.; Shah, R. K. Evaluating the Current Ability of ChatGPT to Assist in Professional Otolaryngology Education. OTO open. 2023;7(4):e94.",Shool2025_supp_ref0026
Shool2025,10.1186/s12911-025-02954-4,27,2023,,,"Al Qurashi AAA, I. A. S.; Halawani, I. R.; Asaad, A. H.; Al Dwehji, A. M. O.; Almusa, H. A.; Alharbi, R. I.; Alobaidi, H. A.; Alarki, Smkz; Aljindan, F. K. Can a Machine Ace the Test? Assessing GPT-4.0's Precision in Plastic Surgery Board Examinations. Plastic and reconstructive surgery Global open. 2023;11(12):e5448.",Shool2025_supp_ref0027
Shool2025,10.1186/s12911-025-02954-4,28,2024,,,"Kollitsch LE, K.; Marszalek, M.; Rauchenwald, M.; Brookman-May, S. D.; Burger, M.; Körner-Riffard, K.; May, M. How does artificial intelligence master urological board examinations? A comparative analysis of different Large Language Models' accuracy and reliability in the 2022 In-Service Assessment of the European Board of Urology. World journal of urology. 2024;42(1):20.",Shool2025_supp_ref0028
Shool2025,10.1186/s12911-025-02954-4,29,2023,,,"Huynh LMB, B. T.; Schultis, K.; Quach, A.; Deibert, C. M. New Artificial Intelligence ChatGPT Performs Poorly on the 2022 Self-assessment Study Program for Urology. Urology practice. 2023;10(4):409-15.",Shool2025_supp_ref0029
Shool2025,10.1186/s12911-025-02954-4,30,2023,,,"Deebel NAT, R. ChatGPT Performance on the American Urological Association Self-assessment Study Program and the Potential Influence of Artificial Intelligence in Urologic Training. Urology. 2023;177:29-33.",Shool2025_supp_ref0030
Shool2025,10.1186/s12911-025-02954-4,31,2024,,,"Gritti MNA, H.; Farid, P.; Morgan, C. T. Progression of an Artificial Intelligence Chatbot (ChatGPT) for Pediatric Cardiology Educational Knowledge Assessment. Pediatric cardiology. 2024;45(2):309-13.",Shool2025_supp_ref0031
Shool2025,10.1186/s12911-025-02954-4,32,2023,,,Sareen K. Assessing the ethical capabilities of Chat GPT in healthcare: A study on its proficiency in situational judgement test. Innov Educ Teach Int. 2023.,Shool2025_supp_ref0032
Shool2025,10.1186/s12911-025-02954-4,33,2023,,,"Gilson AS, C. W.; Huang, T.; Socrates, V.; Chi, L.; Taylor, R. A.; Chartash, D. How Does ChatGPT Perform on the United States Medical Licensing Examination? The Implications of Large Language Models for Medical Education and Knowledge Assessment. JMIR medical education. 2023;9:e45312.",Shool2025_supp_ref0033
Shool2025,10.1186/s12911-025-02954-4,34,2023,,,"Mihalache AH, R. S.; Popovic, M. M.; Muni, R. H. ChatGPT-4: An assessment of an upgraded artificial intelligence chatbot in the United States Medical Licensing Examination. Medical teacher. 2023:1-7.",Shool2025_supp_ref0034
Shool2025,10.1186/s12911-025-02954-4,35,2023,,,"Aljindan FKAQ, A. A.; Albalawi, I. A. S.; Alanazi, A. M. M.; Aljuhani, H. A. M.; Almutairi, F. F.; Aldamigh, O. A.; Halawani, I. R.; Alarki, Smkz. ChatGPT Conquers the Saudi Medical Licensing Exam: Exploring the Accuracy of Artificial Intelligence in Medical Knowledge Assessment and Implications for Modern Medical Education. CUREUS JOURNAL OF MEDICAL SCIENCE. 2023;15(9).",Shool2025_supp_ref0035
Shool2025,10.1186/s12911-025-02954-4,36,2023,,,"Lai UHW, K. S.; Hsu, T. Y.; Kan, J. K. C. Evaluating the performance of ChatGPT-4 on the United Kingdom Medical Licensing Assessment. Frontiers in medicine. 2023;10:1240915.",Shool2025_supp_ref0036
Shool2025,10.1186/s12911-025-02954-4,37,2023,,,"Masikisiki B, Marivate V, Hlophe Y, editors. Investigating the Efficacy of Large Language Models in Reflective Assessment Methods through Chain of Thought Prompting. Proceedings of the 4th African Human Computer Interaction Conference; 2023.",Shool2025_supp_ref0037
Shool2025,10.1186/s12911-025-02954-4,38,2023,,,Giannos P. Evaluating the limits of AI in medical specialisation: ChatGPT's performance on the UK Neurology Specialty Certificate Examination. BMJ neurology open. 2023;5(1):e000451.,Shool2025_supp_ref0038
Shool2025,10.1186/s12911-025-02954-4,39,2023,,,"Antaki FT, S.; Milad, D.; El -Khoury, J.; Duval, R. Evaluating the Performance of ChatGPT in Ophthalmology. OPHTHALMOLOGY SCIENCE. 2023;3(4).",Shool2025_supp_ref0039
Shool2025,10.1186/s12911-025-02954-4,40,2023,,,"Singer MBF, J. J.; Chow, J.; Teng, C. C. Development and Evaluation of Aeyeconsult: A Novel Ophthalmology Chatbot Leveraging Verified Textbook Knowledge and GPT-4. Journal of surgical education. 2023.",Shool2025_supp_ref0040
Shool2025,10.1186/s12911-025-02954-4,41,2023,,,"Kung JEM, C.; Gauthier, C.; Gonzalez, T. A.; Jackson, J. B., 3rd. Evaluating ChatGPT Performance on the Orthopaedic In-Training Examination. JB & JS open access. 2023;8(3).",Shool2025_supp_ref0041
Shool2025,10.1186/s12911-025-02954-4,42,2023,,,"Humar PA, M.; Bengur, F. B.; Nguyen, V. ChatGPT Is Equivalent to First-Year Plastic Surgery Residents: Evaluation of ChatGPT on the Plastic Surgery In-Service Examination. Aesthetic surgery journal. 2023;43(12):Np1085-np9.",Shool2025_supp_ref0042
Shool2025,10.1186/s12911-025-02954-4,43,2023,,,"Piccolo SRD, P.; Luxton-Reilly, A.; Payne, S. H.; Ridge, P. G. Evaluating a large language model's ability to solve programming exercises from an introductory bioinformatics course. PLoS computational biology. 2023;19(9):e1011511.",Shool2025_supp_ref0043
Shool2025,10.1186/s12911-025-02954-4,44,2023,,,"Nastasi AJC, K. R.; Halpern, S. D.; Weissman, G. E. A vignette-based evaluation of ChatGPT's ability to provide appropriate and equitable medical advice across care contexts. Scientific reports. 2023;13(1):17885.",Shool2025_supp_ref0044
Shool2025,10.1186/s12911-025-02954-4,45,2023,,,"Kusunose KK, S.; Sata, M. Evaluation of the Accuracy of ChatGPT in Answering Clinical Questions on the Japanese Society of Hypertension Guidelines. Circulation journal : official journal of the Japanese Circulation Society. 2023;87(7):1030-3.",Shool2025_supp_ref0045
Shool2025,10.1186/s12911-025-02954-4,46,2024,,,"Yan SD, D.; Liu, X.; Dai, Y.; Kim, M. K.; Zhou, X.; Wang, L.; Zhang, L.; Jiang, X. Assessment of the Reliability and Clinical Applicability of ChatGPT's Responses to Patients' Common Queries About Rosacea. Patient preference and adherence. 2024;18:249-53.",Shool2025_supp_ref0046
Shool2025,10.1186/s12911-025-02954-4,47,2023,,,"Lam Hoai XLS, T. Comparing Meta-Analyses with ChatGPT in the Evaluation of the Effectiveness and Tolerance of Systemic Therapies in Moderate-to-Severe Plaque Psoriasis. Journal of clinical medicine. 2023;12(16).",Shool2025_supp_ref0047
Shool2025,10.1186/s12911-025-02954-4,48,2023,,,"Hoai XLLS, T. Comparing Meta-Analyses with ChatGPT in the Evaluation of the Effectiveness and Tolerance of Systemic Therapies in Moderate-to-Severe Plaque Psoriasis. JOURNAL OF CLINICAL MEDICINE. 2023;12(16).",Shool2025_supp_ref0048
Shool2025,10.1186/s12911-025-02954-4,49,2023,,,"Koeroglu EYF, S.; Bestepe, N.; Tam, A. A.; Seyrek, N. C.; Topaloglu, O.; Ersoy, R.; Cakir, B. A Novel Approach: Evaluating ChatGPT's Utility for the Management of Thyroid Nodules. CUREUS JOURNAL OF MEDICAL SCIENCE. 2023;15(10).",Shool2025_supp_ref0049
Shool2025,10.1186/s12911-025-02954-4,50,2023,,,"Barlas TA, A. E.; Akturk, M.; Toruner, F. B. Credibility of ChatGPT in the assessment of obesity in type 2 diabetes according to the guidelines. INTERNATIONAL JOURNAL OF OBESITY. 2023.",Shool2025_supp_ref0050
Shool2025,10.1186/s12911-025-02954-4,51,2024,,,"Wang ZXZ, Z.; Traverso, A.; Dekker, A.; Qian, L. X.; Sun, P. F. Assessing the role of GPT-4 in thyroid ultrasound diagnosis and treatment recommendations: enhancing interpretability with a chain of thought approach. QUANTITATIVE IMAGING IN MEDICINE AND SURGERY. 2024.",Shool2025_supp_ref0051
Shool2025,10.1186/s12911-025-02954-4,52,2024,,,"Onder CEK, G.; Gokbulut, P.; Taskaldiran, I.; Kuskonmaz, S. M. Evaluation of the reliability and readability of ChatGPT-4 responses regarding hypothyroidism during pregnancy. Scientific reports. 2024;14(1):243.",Shool2025_supp_ref0052
Shool2025,10.1186/s12911-025-02954-4,53,2023,,,"Lahat AS, E.; Avidan, B.; Glicksberg, B.; Klang, E. Evaluating the Utility of a Large Language Model in Answering Common Patients' Gastrointestinal Health-Related Questions: Are We There Yet? Diagnostics (Basel, Switzerland). 2023;13(11).",Shool2025_supp_ref0053
Shool2025,10.1186/s12911-025-02954-4,54,2023,,,"Klang ES, A.; Nadkarni, G. N. Evaluating the role of ChatGPT in gastroenterology: a comprehensive systematic review of applications, benefits, and limitations. Ther Adv Gastroenterol. 2023;16.",Shool2025_supp_ref0054
Shool2025,10.1186/s12911-025-02954-4,55,2023,,,"Yeo YHS, J. S.; Ng, W. H.; Ting, P. S.; Trivedi, H.; Vipani, A.; Ayoub, W.; Yang, J. D.; Liran, O.; Spiegel, B.; Kuo, A. Assessing the performance of ChatGPT in answering questions regarding cirrhosis and hepatocellular carcinoma. Clinical and molecular hepatology. 2023;29(3):721-32.",Shool2025_supp_ref0055
Shool2025,10.1186/s12911-025-02954-4,56,2023,,,"Walker HLG, S.; Kuemmerli, C.; Nebiker, C. A.; Müller, B. P.; Raptis, D. A.; Staubli, S. M. Reliability of Medical Information Provided by ChatGPT: Assessment Against Clinical Guidelines and Patient Information Quality Instrument. Journal of medical Internet research. 2023;25:e47479.",Shool2025_supp_ref0056
Shool2025,10.1186/s12911-025-02954-4,57,2023,,,"Biri SKK, S.; Panigrahi, M.; Mondal, S.; Behera, J. K.; Himel, M. Assessing the Utilization of Large Language Models in Medical Education: Insights From Undergraduate Medical Students. CUREUS JOURNAL OF MEDICAL SCIENCE. 2023;15(10).",Shool2025_supp_ref0057
Shool2025,10.1186/s12911-025-02954-4,58,2024,,,"Tirumala AKGM, S.; Trivedi, N.; Shivakumar, D.; Singh, A.; Shariff, S. A cross-sectional study to assess response generated by ChatGPT and ChatSonic to patient queries about Epilepsy. Telemat Inform Rep. 2024;13.",Shool2025_supp_ref0058
Shool2025,10.1186/s12911-025-02954-4,59,2023,,,"Huang SSS, Q.; Beiting, K. J.; Duggan, M. C.; Hines, K.; Murff, H.; Leung, V.; Powers, J.; Harvey, T. S.; Malin, B.; Yin, Z. Fact Check: Assessing the Response of ChatGPT to Alzheimer's Disease Statements with Varying Degrees of Misinformation. medRxiv. 2023.",Shool2025_supp_ref0059
Shool2025,10.1186/s12911-025-02954-4,60,2024,,,"Wu YZ, Z.; Dong, X.; Hong, S.; Hu, Y.; Liang, P.; Li, L.; Zou, B.; Wu, X.; Wang, D.; Chen, H.; Qiu, H.; Tang, H.; Kang, K.; Li, Q.; Zhai, X. Evaluating the performance of the language model ChatGPT in responding to common questions of people with epilepsy. Epilepsy & behavior : E&B. 2024;151:109645.",Shool2025_supp_ref0060
Shool2025,10.1186/s12911-025-02954-4,61,2023,,,"Naik HRP, A. D.; Gurda, G. T. Synchronous Bilateral Breast Cancer: A Case Report Piloting and Evaluating the Implementation of the AI-Powered Large Language Model (LLM) ChatGPT. Cureus. 2023;15(4):e37587.",Shool2025_supp_ref0061
Shool2025,10.1186/s12911-025-02954-4,62,2024,,,"Janopaul-Naylor JRK, A.; Qian, D. C.; McCall, N. S.; Liu, Y.; Patel, S. A. Physician Assessment of ChatGPT and Bing Answers to American Cancer Society's Questions to Ask About Your Cancer. American journal of clinical oncology. 2024;47(1):17-21.",Shool2025_supp_ref0062
Shool2025,10.1186/s12911-025-02954-4,63,2024,,,"Peng WF, Y.; Yao, C.; Zhang, S.; Zhuo, H.; Qiu, T.; Zhang, Y.; Tang, J.; Gu, Y.; Sun, Y. Evaluating AI in medicine: a comparative analysis of expert and ChatGPT responses to colorectal cancer questions. Scientific reports. 2024;14(1):2840.",Shool2025_supp_ref0063
Shool2025,10.1186/s12911-025-02954-4,64,2023,,,"Hermann CEP, J. M.; Boyd, L.; Aviki, E.; Stasenko, M. Let's chat about cervical cancer: Assessing the accuracy of ChatGPT responses to cervical cancer questions. GYNECOLOGIC ONCOLOGY. 2023;179:164-8.",Shool2025_supp_ref0064
Shool2025,10.1186/s12911-025-02954-4,65,2024,,,"Haver HLG, A. K.; Ambinder, E. B.; Bahl, M.; Oluyemi, E. T.; Jeudy, J.; Yi, P. H. Evaluating the Use of ChatGPT to Accurately Simplify Patient-centered Information about Breast Cancer Prevention and Screening. Radiology Imaging cancer. 2024;6(2):e230086.",Shool2025_supp_ref0065
Shool2025,10.1186/s12911-025-02954-4,66,2024,,,"Wei KF, C.; Rajasekaran, K. Answering head and neck cancer questions: An assessment of ChatGPT responses. American journal of otolaryngology. 2024;45(1):104085.",Shool2025_supp_ref0066
Shool2025,10.1186/s12911-025-02954-4,67,2023,,,"Benirschke RCW, J.; Prasai, K.; Freeman, A.; Lee, J. M.; Groth, J. Assessment of a large language model's utility in helping pathology professionals answer general knowledge pathology questions. AMERICAN JOURNAL OF CLINICAL PATHOLOGY. 2023.",Shool2025_supp_ref0067
Shool2025,10.1186/s12911-025-02954-4,68,2023,,,"Chen S, Wu M, Zhu KQ, Lan K, Zhang Z, Cui L. LLM-empowered chatbots for psychiatrist and patient simulation: application and evaluation. arXiv preprint arXiv:230513614. 2023.",Shool2025_supp_ref0068
Shool2025,10.1186/s12911-025-02954-4,69,2023,,,"Panagoulias DPP, F. A.; Virvou, M.; Tsihrintzis, G. A., editor Evaluating the Potential of LLMs and ChatGPT on Medical Diagnosis and Treatment. 14th International Conference on Information, Intelligence, Systems and Applications, IISA 2023; 2023: Institute of Electrical and Electronics Engineers Inc.",Shool2025_supp_ref0069
Shool2025,10.1186/s12911-025-02954-4,70,2023,,,"Campbell DJE, L. E.; Mastrolonardo, E. V.; Amin, D. R.; Huntley, C. T.; Boon, M. S. Evaluating ChatGPT responses on obstructive sleep apnea for patient education. Journal of clinical sleep medicine : JCSM : official publication of the American Academy of Sleep Medicine. 2023;19(12):1989-95.",Shool2025_supp_ref0070
Shool2025,10.1186/s12911-025-02954-4,71,2023,,,"Sarangi PKL, A.; Swarup, M. S.; Panda, S.; Sahoo, S. S.; Hui, P.; Choudhary, A.; Mohakud, S.; Patel, R. K.; Mondal, H. Assessing ChatGPT's Proficiency in Simplifying Radiological Reports for Healthcare Professionals and Patients. Cureus. 2023;15(12):e50881.",Shool2025_supp_ref0071
Shool2025,10.1186/s12911-025-02954-4,72,2023,,,"Gordon EBT, A. J.; Wingrove, P.; Shafique, U.; Haas, B.; Kitts, A. B.; Feldman, J.; Furlan, A. Enhancing Patient Communication With Chat-GPT in Radiology: Evaluating the Efficacy and Readability of Answers to Common Imaging-Related Questions. Journal of the American College of Radiology : JACR. 2023.",Shool2025_supp_ref0072
Shool2025,10.1186/s12911-025-02954-4,73,2023,,,"Sethi HSM, S.; Mali, C.; Dubey, R. Online for On Call: A Study Assessing the Use of Internet Resources Including ChatGPT among On-Call Radiology Residents in India. The Indian journal of radiology & imaging. 2023;33(4):440-9.",Shool2025_supp_ref0073
Shool2025,10.1186/s12911-025-02954-4,74,2023,,,"Irfan BY, A. ChatGPT's Epoch in Rheumatological Diagnostics: A Critical Assessment in the Context of Sjögren's Syndrome. Cureus. 2023;15(10):e47754.",Shool2025_supp_ref0074
Shool2025,10.1186/s12911-025-02954-4,75,2024,,,"Fahy SO, S.; Milinkovic, D.; Jung, T.; Bartek, B. Assessment of Quality and Readability of Information Provided by ChatGPT in Relation to Anterior Cruciate Ligament Injury. Journal of personalized medicine. 2024;14(1).",Shool2025_supp_ref0075
Shool2025,10.1186/s12911-025-02954-4,76,2023,,,"Samaan JSY, Y. H.; Rajeev, N.; Hawley, L.; Abel, S.; Ng, W. H.; Srinivasan, N.; Park, J.; Burch, M.; Watson, R.; Liran, O.; Samakar, K. Assessing the Accuracy of Responses by the Language Model ChatGPT to Questions Regarding Bariatric Surgery. Obesity surgery. 2023;33(6):1790-6.",Shool2025_supp_ref0076
Shool2025,10.1186/s12911-025-02954-4,77,2023,,,"Nikdel MG, H.; Tavakoli, M.; Suh, D. W. Assessment of the Responses of the Artificial Intelligence-based Chatbot ChatGPT-4 to Frequently Asked Questions About Amblyopia and Childhood Myopia. Journal of pediatric ophthalmology and strabismus. 2023:1-4.",Shool2025_supp_ref0077
Shool2025,10.1186/s12911-025-02954-4,78,2024,,,"Al-Sharif EMP, R. C.; Dib El Jalbout, N.; Topilow, N. J.; Shoji, M. K.; Kikkawa, D. O.; Liu, C. Y.; Korn, B. S. Evaluating the Accuracy of ChatGPT and Google BARD in Fielding Oculoplastic Patient Queries: A Comparative Study on Artificial versus Human Intelligence. Ophthalmic plastic and reconstructive surgery. 2024.",Shool2025_supp_ref0078
Shool2025,10.1186/s12911-025-02954-4,79,2023,,,"Balas MJ, A.; Daigle, P.; Nijhawan, N.; Hussain, A.; Gill, H.; Lahaie, G. L.; Belliveau, M. J.; Crawford, S. A.; Arjmand, P.; Ing, E. B. Evaluating ChatGPT on Orbital and Oculofacial Disorders: Accuracy and Readability Insights. Ophthalmic plastic and reconstructive surgery. 2023.",Shool2025_supp_ref0079
Shool2025,10.1186/s12911-025-02954-4,80,2023,,,"Zhou YM, C.; Szatkowski, J.; Moore, D.; Stevens, J. Evaluating ChatGPT responses in the context of a 53-year-old male with a femoral neck fracture: a qualitative analysis. European journal of orthopaedic surgery & traumatology : orthopedie traumatologie. 2023.",Shool2025_supp_ref0080
Shool2025,10.1186/s12911-025-02954-4,81,2023,,,"Dubin JAB, S. S.; Chen, Z.; Hameed, D.; Nace, J.; Mont, M. A.; Delanois, R. E. Using a Google Web Search Analysis to Assess the Utility of ChatGPT in Total Joint Arthroplasty. The Journal of arthroplasty. 2023;38(7):1195-202.",Shool2025_supp_ref0081
Shool2025,10.1186/s12911-025-02954-4,82,2023,,,"Hurley ETC, B. S.; Lorentz, S. G.; Danilkowicz, R. M.; Lau, B. C.; Taylor, D. C.; Dickens, J. F.; Anakwenze, O.; Klifto, C. S. Evaluation High-Quality of Information from ChatGPT (Artificial Intelligence-Large Language Model) Artificial Intelligence on Shoulder Stabilization Surgery. Arthroscopy : the journal of arthroscopic & related surgery : official publication of the Arthroscopy Association of North America and the International Arthroscopy Association. 2023.",Shool2025_supp_ref0082
