sr_id,sr_doi,refnum,year,doi,url,raw,bib_key
Shool2025,10.1186/s12911-025-02954-4,325,2024,,,"Shi RL, S.; Xu, X.; Ye, Z.; Yang, J.; Le, Q.; Qiu, J.; Tian, L.; Wei, A.; Shan, K.; Zhao, C.; Sun, X.; Zhou, X.; Hong, J. Benchmarking four large language models' performance of addressing Chinese patients' inquiries about dry eye disease: A two-phase study. Heliyon. 2024;10(14):e34391.",Shool2025_supp_ref0325
Shool2025,10.1186/s12911-025-02954-4,326,2024,,,"Zhang BD, Y.; Duan, W.; Chen, Z. Benchmarking Large Language Models for Cervical Spondylosis. JMIR formative research. 2024;8:e55577.",Shool2025_supp_ref0326
Shool2025,10.1186/s12911-025-02954-4,327,2024,,,"Li LL, P.; Wang, K.; Zhang, L.; Ji, H.; Zhao, H. Benchmarking State-of-the-Art Large Language Models for Migraine Patient Education: Performance Comparison of Responses to Common Queries. Journal of medical Internet research. 2024;26:e55927.",Shool2025_supp_ref0327
Shool2025,10.1186/s12911-025-02954-4,328,2024,,,"Zhao FFH, H. J.; Liang, J. J.; Cen, J.; Wang, Y.; Lin, H.; Chen, F.; Li, T. P.; Yang, J. F.; Chen, L.; Cen, L. P. Benchmarking the performance of large language models in uveitis: a comparative analysis of ChatGPT-3.5, ChatGPT-4.0, Google Gemini, and Anthropic Claude3. Eye (London, England). 2024.",Shool2025_supp_ref0328
Shool2025,10.1186/s12911-025-02954-4,329,2024,,,"Chen AC, D. O.; Tian, L. Benchmarking the symptom-checking capabilities of ChatGPT for a broad range of diseases. Journal of the American Medical Informatics Association : JAMIA. 2024;31(9):2084-8.",Shool2025_supp_ref0329
Shool2025,10.1186/s12911-025-02954-4,330,2024,,,"Jairoun AAA-H, S. S.; Shahwan, M.; Al-Qirim, T.; Shahwan, M. Benefit-Risk Assessment of ChatGPT Applications in the Field of Diabetes and Metabolic Illnesses: A Qualitative Study. Clinical medicine insights Endocrinology and diabetes. 2024;17:11795514241235514.",Shool2025_supp_ref0330
Shool2025,10.1186/s12911-025-02954-4,331,2024,,,"Mizuta KH, T.; Harada, Y.; Shimizu, T. Can ChatGPT-4 evaluate whether a differential diagnosis list contains the correct diagnosis as accurately as a physician? Diagnosis (Berlin, Germany). 2024;11(3):321-4.",Shool2025_supp_ref0331
Shool2025,10.1186/s12911-025-02954-4,332,2025,,,"Yüce AY, M.; Misir, A. Can Chat-GPT assist orthopedic surgeons in evaluating the quality of rotator cuff surgery patient information videos? Journal of shoulder and elbow surgery. 2025;34(1):141-6.",Shool2025_supp_ref0332
Shool2025,10.1186/s12911-025-02954-4,333,2024,,,"Zhi Y, Guo Y, Yuan K, Wang H, Xu H, Yao H, et al. Can Large Language Models Logically Predict Myocardial Infarction? Evaluation based on UK Biobank Cohort. arXiv preprint arXiv:240914478. 2024.",Shool2025_supp_ref0333
Shool2025,10.1186/s12911-025-02954-4,334,2024,,,"Kim RM, A.; Barile, J.; Han, K. Y.; Kalash, S.; Papaioannou, H.; Krevskaya, A.; Milanaik, R. Challenging the Chatbot: An Assessment of ChatGPT's Diagnoses and Recommendations for DBP Case Studies. J Dev Behav Pediatr. 2024;45(1):e8-e13.",Shool2025_supp_ref0334
Shool2025,10.1186/s12911-025-02954-4,335,2024,,,"Gravina AGP, R.; Palladino, G.; Imperio, G.; Ventura, A.; Federico, A. Charting new AI education in gastroenterology: Cross-sectional evaluation of ChatGPT and perplexity AI in medical residency exam. Digestive and liver disease : official journal of the Italian Society of Gastroenterology and the Italian Association for the Study of the Liver. 2024;56(8):1304-11.",Shool2025_supp_ref0335
Shool2025,10.1186/s12911-025-02954-4,336,2024,,,"Garg NC, D. J.; Yang, A.; McCann, A.; Moroco, A. E.; Estephan, L. E.; Palmer, W. J.; Krein, H.; Heffelfinger, R. Chatbots as Patient Education Resources for Aesthetic Facial Plastic Surgery: Evaluation of ChatGPT and Google Bard Responses. Facial plastic surgery & aesthetic medicine. 2024;26(6):665-73.",Shool2025_supp_ref0336
Shool2025,10.1186/s12911-025-02954-4,337,2024,,,"Tao BKH, N.; Milkovich, J.; Micieli, J. A. ChatGPT-3.5 and Bing Chat in ophthalmology: an updated evaluation of performance, readability, and informative sources. Eye (London, England). 2024;38(10):1897-902.",Shool2025_supp_ref0337
Shool2025,10.1186/s12911-025-02954-4,338,2024,,,"Aljamaan FM, K. H.; Alhasan, K.; Jamal, A.; Altamimi, I.; Khayat, A.; Alhaboob, A.; Abdulmajeed, N.; Alshahrani, F. S.; Saad, K.; Al-Eyadhy, A.; Al-Tawfiq, J. A.; Temsah, M. H. ChatGPT-3.5 System Usability Scale early assessment among Healthcare Workers: Horizons of adoption in medical practice. Heliyon. 2024;10(7):e28962.",Shool2025_supp_ref0338
Shool2025,10.1186/s12911-025-02954-4,339,2024,,,"Mihalache AH, R. S.; Popovic, M. M.; Muni, R. H. ChatGPT-4: An assessment of an upgraded artificial intelligence chatbot in the United States Medical Licensing Examination. Medical teacher. 2024;46(3):366-72.",Shool2025_supp_ref0339
Shool2025,10.1186/s12911-025-02954-4,340,2024,,,"Yaïci RC, M.; Bock, R.; Moayed, F.; Bechrakis, N. E.; Berens, P.; Feltgen, N.; Friedburg, D.; Gräf, M.; Guthoff, R.; Hoffmann, E. M.; Hoerauf, H.; Hintschich, C.; Kohnen, T.; Messmer, E. M.; Nentwich, M. M.; Pleyer, U.; Schaudig, U.; Seitz, B.; Geerling, G.; Roth, M. [ChatGPT and the German board examination for ophthalmology: an evaluation]. Die Ophthalmologie. 2024;121(7):554-64.",Shool2025_supp_ref0340
Shool2025,10.1186/s12911-025-02954-4,341,2024,,,"Siu AHYG, D. P.; Chiu, C.; Kwok, A.; Irwin, M.; Christie, A.; Koh, C. E.; Keshava, A.; Reece, M.; Suen, M.; Rickard, Mjfx. ChatGPT as a patient education tool in colorectal cancer-An in-depth assessment of efficacy, quality and readability. Colorectal Dis. 2024:9.",Shool2025_supp_ref0341
Shool2025,10.1186/s12911-025-02954-4,342,2024,,,"Mese IK, B. ChatGPT as an effective tool for quality evaluation of radiomics research. European radiology. 2024.",Shool2025_supp_ref0342
Shool2025,10.1186/s12911-025-02954-4,343,2024,,,"Lotto CS, S. C.; Anschuetz, W.; Stricker, D.; Molinari, G.; Huwendiek, S.; Anschuetz, L. ChatGPT Generated Otorhinolaryngology Multiple-Choice Questions: Quality, Psychometric Properties, and Suitability for Assessments. OTO open. 2024;8(3):e70018.",Shool2025_supp_ref0343
Shool2025,10.1186/s12911-025-02954-4,344,2024,,,"Dergaa IF-R, F.; Hallit, S.; Loch, A. A.; Glenn, J. M.; Fessi, M. S.; Ben Aissa, M.; Souissi, N.; Guelmami, N.; Swed, S.; El Omri, A.; Bragazzi, N. L.; Ben Saad, H. ChatGPT is not ready yet for use in providing mental health assessment and interventions. Frontiers in psychiatry. 2024;14:12.",Shool2025_supp_ref0344
Shool2025,10.1186/s12911-025-02954-4,345,2024,,,"Phillips VK, F.; Arefin, S.; Choudhary, N.; Garifullin, R. ChatGPT versus Google Gemini: a comparison to evaluate patient education guide created on common neurological disorders. Discov Artif Intell. 2024;4(1).",Shool2025_supp_ref0345
Shool2025,10.1186/s12911-025-02954-4,346,2024,,,"Klotz RP, T. M.; Kaiser, J.; Joos, M. C.; Hecktor, R.; Ahmed, A.; Dörr-Harim, C.; Mehrabi, A.; Loos, M.; Roth, S.; Michalski, C. W.; Kahlert, C. ChatGPT vs. surgeons on pancreatic cancer queries: accuracy & empathy evaluated by patients and experts. HPB : the official journal of the International Hepato Pancreato Biliary Association. 2024.",Shool2025_supp_ref0346
Shool2025,10.1186/s12911-025-02954-4,347,2024,,,"Scheschenja MB, M. B.; Wessendorf, J.; Owczarek, A. D.; König, A. M.; Viniol, S.; Mahnken, A. H. ChatGPT: Evaluating answers on contrast media related questions and finetuning by providing the model with the ESUR guideline on contrast agents. Current problems in diagnostic radiology. 2024;53(4):488-93.",Shool2025_supp_ref0347
Shool2025,10.1186/s12911-025-02954-4,348,2024,,,"Han YC, H. S.; Simon, M. E.; Katt, B. M. ChatGPT's Performance on the Hand Surgery Self-Assessment Exam: A Critical Analysis. J Hand Surg Glob Online. 2024;6(2):200-5.",Shool2025_supp_ref0348
Shool2025,10.1186/s12911-025-02954-4,349,2024,,,"Ma MD, Ye C, Yan Y, Wang X, Ping P, Chang TS, et al. CliBench: Multifaceted Evaluation of Large Language Models in Clinical Decisions on Diagnoses, Procedures, Lab Tests Orders and Prescriptions. arXiv preprint arXiv:240609923. 2024.",Shool2025_supp_ref0349
Shool2025,10.1186/s12911-025-02954-4,350,2024,,,"Zhang Y, Hou S, Ma MD, Wang W, Chen M, Zhao J. CLIMB: A Benchmark of Clinical Bias in Large Language Models. arXiv preprint arXiv:240705250. 2024.",Shool2025_supp_ref0350
Shool2025,10.1186/s12911-025-02954-4,351,2024,,,"Ouyang Z, Qiu Y, Wang L, De Melo G, Zhang Y, Wang Y, et al. CliMedBench: A Large-Scale Chinese Benchmark for Evaluating Medical Large Language Models in Clinical Scenarios. arXiv preprint arXiv:241003502. 2024.",Shool2025_supp_ref0351
Shool2025,10.1186/s12911-025-02954-4,352,2024,,,"Genes MD, B. A Clinical Evaluation of Cardiovascular Emergencies: A Comparison of Responses from ChatGPT, Emergency Physicians, and Cardiologists. Diagnostics. 2024;14(23):12.",Shool2025_supp_ref0352
Shool2025,10.1186/s12911-025-02954-4,353,2024,,,"Meral GA, S.; Günay, S.; Öztürk, A.; Kudogan, M. Comparative analysis of ChatGPT, Gemini and emergency medicine specialist in ESI triage assessment. Am J Emerg Med. 2024;81:146-50.",Shool2025_supp_ref0353
Shool2025,10.1186/s12911-025-02954-4,354,2024,,,"Almekkawi AKC, J. P.; Anand, S.; Hawkins, A. M.; Rauf, R.; Al-Shaikhli, M.; Aoun, S. G.; Bagley, C. A. Comparative Analysis of Large Language Models and Spine Surgeons in Surgical Decision-Making and Radiological Assessment for Spine Pathologies. World neurosurgery. 2024;194:123531.",Shool2025_supp_ref0354
Shool2025,10.1186/s12911-025-02954-4,355,2024,,,"Merlino DJB, S. R.; Saieed, G.; Van Abel, K. M.; Price, D. L.; Archibald, D. J.; Ator, G. A.; Carlson, M. L. Comparative Assessment of Otolaryngology Knowledge Among Large Language Models. Laryngoscope. 2024:6.",Shool2025_supp_ref0355
Shool2025,10.1186/s12911-025-02954-4,356,2024,,,"Ghersin IW, R.; Koifman, E.; Bar-Yoseph, H.; Ben Hur, D.; Maza, I.; Hasnis, E.; Nasser, R.; Ovadia, B.; Dror Zur, D.; Waterman, M.; Gorelik, Y. Comparative evaluation of a language model and human specialists in the application of European guidelines for the management of inflammatory bowel diseases and malignancies. Endoscopy. 2024;56(9):706-9.",Shool2025_supp_ref0356
Shool2025,10.1186/s12911-025-02954-4,357,2024,,,"Gupta RH, A. M.; Jhaveri, M.; Patel, N.; Suthar, P. P. Comparative Evaluation of AI Models Such as ChatGPT 3.5, ChatGPT 4.0, and Google Gemini in Neuroradiology Diagnostics. Cureus. 2024;16(8):e67766.",Shool2025_supp_ref0357
Shool2025,10.1186/s12911-025-02954-4,358,2024,,,"Gunesli IA, S.; Fathelbab, J.; Yildiz, B. O. Comparative evaluation of ChatGPT-4, ChatGPT-3.5 and Google Gemini on PCOS assessment and management based on recommendations from the 2023 guideline. Endocrine. 2024.",Shool2025_supp_ref0358
Shool2025,10.1186/s12911-025-02954-4,359,2024,,,"Fisher ADF, G.; George, R.; Hay, E.; Wolla, C. D.; Wolf, B. J. Comparative evaluation of ChatGPT versions in anesthesia patient education for total hip arthroplasty. J Med Artif Intell. 2024;7.",Shool2025_supp_ref0359
Shool2025,10.1186/s12911-025-02954-4,360,2024,,,"Kepez MSU, F. Comparative Evaluation of Information Quality on Colon Cancer for Patients: A Study of ChatGPT-4 and Google. Cureus. 2024;16(11):e73989.",Shool2025_supp_ref0360
Shool2025,10.1186/s12911-025-02954-4,361,2024,,,"Miller LK, P.; Patel, J.; Agrawal, J.; Zhan, M.; Bumbarger, N.; Wang, K. A Comparative Evaluation of Large Language Model Utility in Neuroimaging Clinical Decision Support. Journal of imaging informatics in medicine. 2024.",Shool2025_supp_ref0361
Shool2025,10.1186/s12911-025-02954-4,362,2024,,,"Gupta AR, A.; Malhotra, H.; Rangarajan, K. Comparative Evaluation of Large Language Models for Translating Radiology Reports into Hindi. Indian J Radiol Imaging. 2024;35(1):88-96.",Shool2025_supp_ref0362
Shool2025,10.1186/s12911-025-02954-4,363,2024,,,"Rydzewski NRD, D.; Zhao, S. G.; Ruppin, E.; Turkbey, B.; Citrin, D. E.; Patel, K. R. Comparative Evaluation of LLMs in Clinical Oncology. Nejm ai. 2024;1(5).",Shool2025_supp_ref0363
Shool2025,10.1186/s12911-025-02954-4,364,2024,,,"Is EEM, A. K. Comparative performance of artificial intelligence models in rheumatology board-level questions: evaluating Google Gemini and ChatGPT-4o. Clinical rheumatology. 2024;43(11):3507-13.",Shool2025_supp_ref0364
Shool2025,10.1186/s12911-025-02954-4,365,2024,,,"Patil NSH, R. S.; van der Pol, C. B.; Larocque, N. Comparative Performance of ChatGPT and Bard in a Text-Based Radiology Knowledge Assessment. Canadian Association of Radiologists journal = Journal l'Association canadienne des radiologistes. 2024;75(2):344-50.",Shool2025_supp_ref0365
Shool2025,10.1186/s12911-025-02954-4,366,2024,,,"Chen CJS, K.; Hickey, C.; Raphael, J. The Comparative Performance of Large Language Models on the Hand Surgery Self-Assessment Examination. Hand (New York, NY). 2024:15589447241279460.",Shool2025_supp_ref0366
Shool2025,10.1186/s12911-025-02954-4,367,2024,,,Demirci A. A Comparison of ChatGPT and Human Questionnaire Evaluations of the Urological Cancer Videos Most Watched on YouTube. Clinical genitourinary cancer. 2024;22(5):102145.,Shool2025_supp_ref0367
Shool2025,10.1186/s12911-025-02954-4,368,2024,,,"Günay SÖ, A.; Özerol, H.; Yiğit, Y.; Erenler, A. K. Comparison of emergency medicine specialist, cardiologist, and chat-GPT in electrocardiography assessment. The American journal of emergency medicine. 2024;80:51-60.",Shool2025_supp_ref0368
Shool2025,10.1186/s12911-025-02954-4,369,2024,,,"Gill GST, J.; Moxam, J.; Sanghvi, H. A.; Gupta, S. Comparison of Gemini Advanced and ChatGPT 4.0's Performances on the Ophthalmology Resident Ophthalmic Knowledge Assessment Program (OKAP) Examination Review Question Banks. Cureus. 2024;16(9):e69612.",Shool2025_supp_ref0369
Shool2025,10.1186/s12911-025-02954-4,370,2024,,,"Abi-Rafeh JM, V. J.; Bassiri-Tehrani, B.; Marks, J.; Kazan, R.; Nahai, F. Complications Following Body Contouring: Performance Validation of Bard, a Novel AI Large Language Model, in Triaging and Managing Postoperative Patient Concerns. Aesthetic plastic surgery. 2024;48(5):953-76.",Shool2025_supp_ref0370
Shool2025,10.1186/s12911-025-02954-4,371,2024,,,"Asiedu M, Tomasev N, Ghate C, Tiyasirichokchai T, Dieng A, Akande O, et al. Contextual Evaluation of Large Language Models for Classifying Tropical and Infectious Diseases. arXiv preprint arXiv:240909201. 2024.",Shool2025_supp_ref0371
Shool2025,10.1186/s12911-025-02954-4,372,2024,,,"Barlas TA, A. E.; Akturk, M.; Toruner, F. B. Credibility of ChatGPT in the assessment of obesity in type 2 diabetes according to the guidelines. International Journal of Obesity. 2024;48(2):271-5.",Shool2025_supp_ref0372
Shool2025,10.1186/s12911-025-02954-4,373,2024,,,"Aali AVV, D.; Arefeen, Y. I.; Hom, J.; Bluethgen, C.; Reis, E. P.; Gatidis, S.; Clifford, N.; Daws, J.; Tehrani, A. S.; Kim, J.; Chaudhari, A. S. A dataset and benchmark for hospital course summarization with adapted large language models. Journal of the American Medical Informatics Association : JAMIA. 2024.",Shool2025_supp_ref0373
Shool2025,10.1186/s12911-025-02954-4,374,2025,,,"Pandya SB, T. E.; Wilson, T.; Htway, Z.; Fujita, M. Decoding the NCCN Guidelines With AI: A Comparative Evaluation of ChatGPT-4.0 and Llama 2 in the Management of Thyroid Carcinoma. The American surgeon. 2025;91(1):94-8.",Shool2025_supp_ref0374
Shool2025,10.1186/s12911-025-02954-4,375,2024,,,"Hartman VZ, X.; Poddar, R.; McCarty, M.; Fortenko, A.; Sholle, E.; Sharma, R.; Campion, T., Jr.; Steel, P. A. D. Developing and Evaluating Large Language Model-Generated Emergency Medicine Handoff Notes. JAMA network open. 2024;7(12):e2448723.",Shool2025_supp_ref0375
Shool2025,10.1186/s12911-025-02954-4,376,2024,,,"Zheng CY, H.; Guo, J.; Yang, J.; Fei, P.; Yuan, Y.; Huang, D.; Huang, Y.; Peng, J.; Xie, X.; Xie, M.; Zhao, P.; Chen, L.; Zhang, M. Development and evaluation of a large language model of ophthalmology in Chinese. The British journal of ophthalmology. 2024;108(10):1390-7.",Shool2025_supp_ref0376
Shool2025,10.1186/s12911-025-02954-4,377,2024,,,"Ma HM, X.; Yang, C.; Niu, Q.; Gao, T.; Liu, C.; Chen, Y. Development and evaluation of a program based on a generative pre-trained transformer model from a public natural language processing platform for efficiency enhancement in post-procedural quality control of esophageal endoscopic submucosal dissection. Surgical endoscopy. 2024;38(3):1264-72.",Shool2025_supp_ref0377
Shool2025,10.1186/s12911-025-02954-4,378,2024,,,"Luo MJP, J.; Bi, S.; Lai, Y.; Zhao, J.; Shang, Y.; Cui, T.; Yang, Y.; Lin, Z.; Zhao, L.; Wu, X.; Lin, D.; Chen, J.; Lin, H. Development and Evaluation of a Retrieval-Augmented Large Language Model Framework for Ophthalmology. JAMA ophthalmology. 2024;142(9):798-805.",Shool2025_supp_ref0378
Shool2025,10.1186/s12911-025-02954-4,379,2024,,,"Singer MBF, J. J.; Chow, J.; Teng, C. C. Development and Evaluation of Aeyeconsult: A Novel Ophthalmology Chatbot Leveraging Verified Textbook Knowledge and GPT-4. Journal of surgical education. 2024;81(3):438-43.",Shool2025_supp_ref0379
Shool2025,10.1186/s12911-025-02954-4,380,2024,,,"Niu C, Kaviani P, Lyu Q, Kalra MK, Whitlow CT, Wang G. Development and Validation of a Dynamic-Template-Constrained Large Language Model for Generating Fully-Structured Radiology Reports. arXiv preprint arXiv:240918319. 2024.",Shool2025_supp_ref0380
Shool2025,10.1186/s12911-025-02954-4,381,2024,,,"Rawashdeh BK, J.; Dunn, T.; Al-Abdallat, H.; Qasem, A.; Bhatt, R.; Prasad, R.; Cooper, M. Diversifying Kidney Transplant Education: Assessing the Artificial Intelligence-Powered Capability of ChatGPT. Transpl. 2024;5(4):271-9.",Shool2025_supp_ref0381
Shool2025,10.1186/s12911-025-02954-4,382,2024,,,"Ghanem YKR, A. D.; Al-Houssan, A.; Saleh, Z.; Moccia, M. C.; Joshi, H.; Dumon, K. R.; Hong, Y.; Spitz, F.; Joshi, A. R.; Kwiatt, M. Dr. Google to Dr. ChatGPT: assessing the content and quality of artificial intelligence-generated medical information on appendicitis. Surgical endoscopy. 2024;38(5):2887-93.",Shool2025_supp_ref0382
Shool2025,10.1186/s12911-025-02954-4,383,2024,,,"Nechay TVS, A. V.; Loban, K. M.; Bogomolova, A. K.; Suglob, V. V.; Beniia, T. R. Efficacy and safety of artificial intelligence-based large language models for decision making support in herniology: evaluation by experts and general surgeons. Pirogov Russ J Surg. 2024(8):6-14.",Shool2025_supp_ref0383
Shool2025,10.1186/s12911-025-02954-4,384,2024,,,"Swisher ARW, A. W.; Liu, G. C.; Lee, M. K.; Carle, T. R.; Tang, D. M. Enhancing Health Literacy: Evaluating the Readability of Patient Handouts Revised by ChatGPT's Large Language Model. Otolaryngology--head and neck surgery : official journal of American Academy of Otolaryngology-Head and Neck Surgery. 2024;171(6):1751-7.",Shool2025_supp_ref0384
Shool2025,10.1186/s12911-025-02954-4,385,2024,,,"Han NYS, K.; Kim, M. J.; Park, B. J.; Sim, K. C.; Han, Y. E.; Sung, D. J.; Choi, J. W.; Yeom, S. K. Enhancing Oncological Surveillance Through Large Language Model-Assisted Analysis: A Comparative Study of GPT-4 and Gemini in Evaluating Oncological Issues From Serial Abdominal CT Scan Reports. Academic radiology. 2024.",Shool2025_supp_ref0385
Shool2025,10.1186/s12911-025-02954-4,386,2024,,,"Zhou HW, H. L.; Duan, Y. Y.; Yan, Z. N.; Luo, R.; Lv, X. X.; Xie, Y.; Zhang, J. Y.; Yang, J. M.; Xue, M. D.; Fang, Y.; Lu, L.; Liu, P. R.; Ye, Z. W. Enhancing Orthopedic Knowledge Assessments: The Performance of Specialized Generative Language Model Optimization. Current medical science. 2024;44(5):1001-5.",Shool2025_supp_ref0386
Shool2025,10.1186/s12911-025-02954-4,387,2024,,,"Gordon EBT, A. J.; Wingrove, P.; Sha, U. M.; Haas, B.; Kitts, A. B.; Feldman, J.; Furlan, A. Enhancing Patient Communication With Chat-GPT in Radiology: Evaluating the Efficacy and Readability of Answers to Common Imaging-Related Questions. J Am Coll Radiol. 2024;21(2):353-9.",Shool2025_supp_ref0387
Shool2025,10.1186/s12911-025-02954-4,388,2024,,,"Liu Y, Li Y, Wang Z, Liang X, Liu L, Wang L, et al. ER2Score: LLM-based Explainable and Customizable Metric for Assessing Radiology Reports with Reward-Control Loss. arXiv preprint arXiv:241117301. 2024.",Shool2025_supp_ref0388
Shool2025,10.1186/s12911-025-02954-4,389,2024,,,"Lan LY, L.; Li, J.; Hou, J.; Yan, Y.; Zhang, Y. Establishing a novel score system and using it to assess and compare the quality of ChatGPT-4 consultation with physician consultation for obstetrics and gynecology: A pilot study. International journal of gynaecology and obstetrics: the official organ of the International Federation of Gynaecology and Obstetrics. 2024.",Shool2025_supp_ref0389
Shool2025,10.1186/s12911-025-02954-4,390,2024,,,"Lin JCK, S. S.; Younessi, D. N.; Scott, I. U.; Gong, D. A. Ethical and Professional Decision-Making Capabilities of Artificial Intelligence Chatbots: Evaluating ChatGPT's Professional Competencies in Medicine. Medical science educator. 2024;34(2):331-3.",Shool2025_supp_ref0390
Shool2025,10.1186/s12911-025-02954-4,391,2024,,,"Alqudah AAA, A. J.; Baker, M.; Alnajjar, Z.; Ayasrah, I.; Ta'ani, Y.; Al Salkhadi, M.; Aljawarneh, S. Evaluating accuracy and reproducibility of ChatGPT responses to patient-based questions in Ophthalmology: An observational study. Medicine. 2024;103(32):e39120.",Shool2025_supp_ref0391
Shool2025,10.1186/s12911-025-02954-4,392,2024,,,"Mahjoubi MS, S.; Sheikhbahaei, S.; Jazi, A. H. D. Evaluating AI Capabilities in Bariatric Surgery: A Study on ChatGPT-4 and DALL·E 3's Recognition and Illustration Accuracy. Obesity surgery. 2024.",Shool2025_supp_ref0392
Shool2025,10.1186/s12911-025-02954-4,393,2024,,,"Ros-Arlanzón PP-S, A. Evaluating AI Competence in Specialized Medicine: Comparative Analysis of ChatGPT and Neurologists in a Neurology Specialist Examination in Spain. JMIR medical education. 2024;10:e56762.",Shool2025_supp_ref0393
Shool2025,10.1186/s12911-025-02954-4,394,2024,,,"Peng Wf, Y.; Yao, C.; Zhang, S.; Zhuo, H.; Qiu, T.; Zhang, Y.; Tang, J.; Gu, Y.; Sun, Y. Evaluating AI in medicine: a comparative analysis of expert and ChatGPT responses to colorectal cancer questions. Scientific Reports. 2024;14(1).",Shool2025_supp_ref0394
Shool2025,10.1186/s12911-025-02954-4,395,2024,,,"Builoff VS, A.; Miller, R. J.; Dey, D.; Liang, J. X.; Flood, K.; Bourque, J. M.; Chareonthaitawee, P.; Phillips, L. M.; Slomka, P. J. Evaluating AI proficiency in nuclear cardiology: Large language models take on the board preparation exam. Journal of nuclear cardiology : official publication of the American Society of Nuclear Cardiology. 2024:102089.",Shool2025_supp_ref0395
Shool2025,10.1186/s12911-025-02954-4,396,2024,,,"Chen XW, L.; You, M.; Liu, W.; Fu, Y.; Xu, J.; Zhang, S.; Chen, G.; Li, K.; Li, J. Evaluating and Enhancing Large Language Models' Performance in Domain-Specific Medicine: Development and Usability Study With DocOA. Journal of medical Internet research. 2024;26:e58158.",Shool2025_supp_ref0396
Shool2025,10.1186/s12911-025-02954-4,397,2024,,,"Arora SR, M.; Moe, A. T.; Giri, T.; Parrikh, K.; Challa, H. V. Evaluating Artificial Intelligence (AI)-Generated Patient Education Guides on Epilepsy: A Cross-Sectional Study of ChatGPT and Google Gemini. Cureus. 2024;16(11):e73212.",Shool2025_supp_ref0397
Shool2025,10.1186/s12911-025-02954-4,398,2024,,,"Al-Naser YH, F.; Ng, B.; Mountford, D.; Sharma, S.; Niure, K.; Yong-Hing, C.; Khosa, F.; Van der Pol, C. Evaluating Artificial Intelligence Competency in Education: Performance of ChatGPT-4 in the American Registry of Radiologic Technologists (ARRT) Radiography Certification Exam. Academic radiology. 2024.",Shool2025_supp_ref0398
Shool2025,10.1186/s12911-025-02954-4,399,2024,,,"Beaulieu-Jones BRB, M. T.; Shah, S.; Marwaha, J. S.; Lai, S. L.; Brat, G. A. Evaluating capabilities of large language models: Performance of GPT-4 on surgical knowledge assessments. Surgery. 2024;175(4):936-42.",Shool2025_supp_ref0399
Shool2025,10.1186/s12911-025-02954-4,400,2024,,,"Amaral JZS, R. J.; Martin, B. M.; Taylor, T.; Touban, B.; McGraw-Heinrich, J.; McKay, S. D.; Rosenfeld, S. B.; Smith, B. G. Evaluating Chat Generative Pre-trained Transformer Responses to Common Pediatric In-toeing Questions. Journal of pediatric orthopedics. 2024;44(7):e592-e7.",Shool2025_supp_ref0400
Shool2025,10.1186/s12911-025-02954-4,401,2024,,,"Lee TJR, A. K.; Campbell, D. J.; Radfar, N.; Dayal, M.; Khrais, A. Evaluating ChatGPT-3.5 and ChatGPT-4.0 Responses on Hyperlipidemia for Patient Education. Cureus. 2024;16(5):e61067.",Shool2025_supp_ref0401
Shool2025,10.1186/s12911-025-02954-4,402,2024,,,"Hirosawa TH, Y.; Mizuta, K.; Sakamoto, T.; Tokumasu, K.; Shimizu, T. Evaluating ChatGPT-4's Accuracy in Identifying Final Diagnoses Within Differential Diagnoses Compared With Those of Physicians: Experimental Study for Diagnostic Cases. JMIR formative research. 2024;8:e59267.",Shool2025_supp_ref0402
Shool2025,10.1186/s12911-025-02954-4,403,2024,,,"Sahin SE, B.; Duymaz, Y. K.; Bayram, F.; Tekin, A. M.; Topsakal, V. Evaluating ChatGPT-4's performance as a digital health advisor for otosclerosis surgery. Frontiers in surgery. 2024;11:1373843.",Shool2025_supp_ref0403
Shool2025,10.1186/s12911-025-02954-4,404,2024,,,"Sarangi PKD, S.; Panda, B. B.; Panda, S.; Mondal, H. Evaluating ChatGPT-4's Performance in Identifying Radiological Anatomy in FRCR Part 1 Examination Questions. Indian J Radiol Imaging. 2024.",Shool2025_supp_ref0404
Shool2025,10.1186/s12911-025-02954-4,405,2024,,,"Triantafyllopoulos LF, G.; Tzelves, L.; Sakagianni, A.; Verykios, V. S.; Kalles, D., editor Evaluating ChatGPT 4.0's User Satisfaction Among Doctors Across Different Medical Departments. Studies in health technology and informatics; 2024: IOS Press BV; 39176797.",Shool2025_supp_ref0405
